title,source,time,summary
国内首只百亿规模慈善信托来了 股权价值已达141.71亿元,金融界,2月24日,两年资助公益事业超4640万元2018年中，鲁伟鼎成立鲁冠球三农扶志基金慈善信托，把万向旗下核心企业之一的万向三农集团有限公司的全部股权无偿授予慈善信托计划，备案规模为6亿元。经资产评估，以2020年6月末为基准日，万向三农集团有限公司股权...
"浙江杭州2021最新富豪榜出炉,47人身价超百亿,首富地位恐不保",网易,1月24日,"No.10,鲁伟鼎——万向集团董事局主席 1971年出生,浙江杭州人,万向集团创始人、前董事局主席鲁冠球之子,现任万向集团董事局主席、执行董事、总裁,硕士学历,高级经济师职称,全国工商联常委,浙江省工商联副主席,70年70企70人“中国杰出贡献..."
"智库头条 | 自主创新,抗疫先锋。为光荣浙商、明峰医疗董事长王瑶...",搜狐网,2020年12月16日,"27鲁伟鼎 万向集团董事长 鲁伟鼎在接棒万向之后始终奔跑不停,尤其在新能源产业加大布局力度,投资2000亿打造万向聚能城。同时还继承父亲鲁冠球在慈善等方面的遗志,将集团公司截至2018年度审计报告的资产全部捐赠设立公益信托“鲁冠球万向事业基金..."
鲁伟鼎拟捐万向公司资产 涉2家上市公司市值逾百亿,中国经济网,2019年7月14日,"目前,万向集团公司旗下持有包括万向钱潮、万向资源、万向电动车、万向新能源客车、万向一二三、上海捷新动力在内的22家子公司股份,其中包含万向钱潮和顺发恒业两家上市公司股权。 近日,万向集团董事长、CEO鲁伟鼎在“万向创业五十周年会议”..."
鲁伟鼎捐万向集团全部资产 设立鲁冠球万向事业基金,浙江在线,2019年7月16日,"浙江在线7月16日讯昨天,万向钱潮发布公告称,在万向内部召开的万向创业50周年大会上,万向实际控制人、董事长兼CEO鲁伟鼎先生宣布:依照万向创始人、董事局主席鲁冠球先生的意愿、情境,万向集团公司董事局决定,按照《信托法》和《慈善法》,正..."
鲁伟鼎宣布捐出万向集团公司资产 万向如何转向?,网易订阅,2019年7月15日,"7月15日午间,万向钱潮发布公告称,控股股东筹划重大事项。日前,在万向创业50周年大会上,万向实际控制人、董事长兼CEO鲁伟鼎宣布成立鲁冠球万向事业基金,捐出万向集团公司截至2018年度审计报告的资产。万向此举引发了各界关注。这可能是中国第..."
鲁伟鼎:将万向集团公司截止2018年度审计报告的资产全部捐赠 设立...,杭州网,2019年7月12日,"7月8日,“万向创业五十周年会议”上,万向集团董事长、CEO鲁伟鼎在讲话中,发布成立一个新的慈善信托——鲁冠球万向事业基金,捐出万向集团公司截止2018年度审计报告的资产。 鲁伟鼎说: 我代表万向董事局,代表家人,也代表万向员工,代表万向..."
鲁伟鼎为何要清仓万向三农集团股权?记者问来了,浙江在线,2018年10月8日,8日，记者查阅工商资料发现，万向三农集团股权已完成调整，持股100%的鲁伟鼎确已退出。万向信托成为新股东，持股比例100%。公开信息显示，万向信托股份公司是一家经中国银监会批准设立的金融机构，控股股东为中国万向控股有限公司，现有股东还...
鲁冠球之子鲁伟鼎正式接棒万向集团,央广网,2017年11月5日,几天来，在来自各界的悲痛与悼念中，万向集团仍然履行着自己的使命，各项工作平稳有序开展。11月3日，万向集团董事局召开特别会议，一致通过实际控制人鲁冠球之子鲁伟鼎成为万向集团公司法定代表人，担任董事长、首席执行官。而万向集团董事...
以父之名 鲁伟鼎捐万向集团所有资产成立事业基金,浙江新闻官网,2019年7月15日,"7月15日,万向钱潮发布公告称,在万向内部召开的万向创业50周年大会上,万向实际控制人、董事长兼CEO鲁伟鼎先生宣布:依照万向创始人、董事局主席鲁冠球先生的意愿、情境,万向集团公司董事局决定,按照《信托法》和《慈善法》,正式开始办理,将..."
延续鲁冠球的慈善梦:鲁伟鼎捐赠万向集团全部资产设公益基金,东方财富网,2019年7月14日,"公益基金的全部收益将用于研发新技术,高端人才教育,开展科技研究,支持设立理工类应用型科研机构。”万向集团公司董事长鲁伟鼎于7月8日万向的五十周年“厂庆”上发表演讲时表示,鲁冠球万向事业基金已按照《信托法》和《慈善法》正式开始办理..."
鲁伟鼎接班近两年 计划推动万向集团股改,财新,2019年7月12日,"【财新网】(记者 彭岩锋)接班近两年之后,鲁伟鼎正计划推动万向集团的股份制改造。7月12日晚间,万向集团董事局工作室负责人向财新记者透露了上述消息。他还称,目前,这一计划尚无方案出台,“也没有明确的时间表”。"
涌金楼 | 万向50周年庆 “创二代”鲁伟鼎说了什么,浙江新闻官网,2019年7月10日,"鲁伟鼎郑重地宣布,万向董事局决定,按照《信托法》和《慈善法》正式开始办理,将万向集团公司截止 2018 年度审计报告的资产,全部捐赠设立鲁冠球万向事业基金。公益基金的全部收益将用于研发新技术,高端人才教育,开展科技研究,支持设立理工类应用..."
"鲁伟鼎正式接棒万向集团,鲁冠球个人财产会怎么分?",金投网,2017年11月14日,鲁冠球有一个儿子，三个女儿。1971年出生的鲁伟鼎是鲁冠球唯一的儿子，也被视为万向集团的继承者。11月3日，万向集团董事局召开特别会议，一致通过实际控制人鲁伟鼎为万向集团公司法定代表人，担任董事长、首席执行官。强忍悲痛的鲁伟鼎，将...
"万向集团董事局召开会议决定,鲁伟鼎正式接棒万向集团",浙江在线,2017年11月5日,11月3日，万向集团董事局召开特别会议。经万向集团董事局会议选举产生，一致通过实际控制人鲁伟鼎为万向集团公司法定代表人，担任董事长、首席执行官。会议决定，万向集团董事局主席职务的称谓作为对创始人鲁冠球同志的尊称和纪念，将被永久...
万向系人事变动:管大源接替鲁伟鼎任万向资源法定代表人,新京报网,2019年6月20日,"新京报记者独家获悉,两家万向系公司日前发生人事变更,万向系老将管大源新任万向资源董事长,同时退出万向控股董事会。 工商资料显示,万向资源有限公司(下称“万向资源”)日前发生人事变更,鲁伟鼎不再担任法定代表人,由管大源接任法定代表人并担..."
万向集团董事长、首席执行官鲁伟鼎:民营企业没有理由做不好,中国经济网,2018年11月12日,"脚下是父辈千辛万苦积累的扎实平台,背靠国家繁荣富强的新时代,作为新一代企业家,我要继承和发扬老一辈人艰苦奋斗、敢闯敢干、聚焦实业、做精主业的精神,踏踏实实做好自己的事情,增强企业创新能力和核心竞争力,努力把万向做强做优,在..."
鲁伟鼎清仓万向三农集团股权 承德露露、万向德农间接控股股东调整...,证券之星,2018年10月7日,【鲁伟鼎清仓万向三农集团股权 承德露露、万向德农间接控股股东调整尘埃落定】10月7日讯，记者自工商资料获悉，万向三农集团股权完成调整，持股100%的鲁伟鼎退出，万向信托成为新股东，导致万向德农和承德露露的间接控股股东发生变更。截至目前，...
鲁伟鼎全面接管万向帝国 承德露露业绩有望触底企稳,搜狐网,2018年3月20日,"3月19日晚,承德露露(000848.SZ)发布公告披露,鲁伟鼎将承继其父鲁冠球所持的万向三农集团有限公司95%股份,并成为万向三农集团法定代表人、董事长。这意味着,鲁伟鼎将正式接管万向千亿帝国。"
鲁冠球之子鲁伟鼎接棒万向集团 正式成公司实际控制人,前瞻网,2017年11月5日,"十天前,72岁的万向集团创始人鲁冠球因病逝世,引发各界关注,公司接下来由谁掌管同样引发侧目。根据最新的消息,本周五万向集团董事局召开特别会议,经过选举后,一致通过鲁冠球之子鲁伟鼎成为公司新的法定代表人,这也意味着,鲁伟鼎成为了集团的..."
"16 年前错过了鲁冠球,但却提问了鲁伟鼎万向造车时间表",ZAKER资讯,2017年10月30日,"务实、沉默、隐忍、低调 14 年后,浙商鲁冠球、鲁伟鼎父子领导的万向集团开始造车:规划 5 万辆增程式纯电动乘用车基地。此前一直声称不会贸然进军整车制造领域的中国汽车零部件领军大佬——万向,成为第 6 个 "" 不声不响 "" 拿到纯电动..."
鲁伟鼎正式接棒万向集团 押注清洁能源还是金控帝国?,界面新闻,2017年11月6日,"随着中国大力推进能源转型,更坚定了鲁冠球的决心和信心。2013年,万向集团收购了美国先进电池企业A123系统公司,2014年在美国投资超豪华电动车karma公司,2015年成立上汽万向新能源客车公司。 这些收购中不乏鲁伟鼎的身影。鲁冠球对其业绩也给予了..."
万向集团执行董事、首席执行官 鲁伟鼎,央视网经济频道,2012年12月5日,"鲁伟鼎个人简介: 1971年3月生,浙江杭州人,EMBA,高级经济师,中共党员,现任万向集团执行董事、首席执行官,民生保险董事长、首席执行官。 2012年是万向确立国际化发展新高度的关键一年,国际化产出和投入都不出意料地强劲。在北美生产的每3..."
万向集团董事长鲁伟鼎:万向和浙江日报唇齿相依40年,浙江在线,2019年5月9日,万向集团董事长鲁伟鼎:万向和浙江日报唇齿相依40年媒立方 已发布31871条视频 来源: 发布时间:2019-05-09 22:01:17 万向集团董事长鲁伟鼎:万向和浙江日报唇齿相依40年< 合作媒体 优酷网 土豆网 腾讯视频 新浪视频 搜狐视频 凤凰视频 ...
[收购]万向德农:黑龙江国安律师事务所关于鲁伟鼎先生免于提交豁免...,中国财经信息网,2018年3月19日,"六条规定的不得收购上市公司股份的情形,符合收购上市公司股份的 主体资格。 二、 本次收购的基本情况 (一)本次收购的基本情况 收购人鲁伟鼎先生为鲁冠球先生的儿子。鲁冠球先生有公司控股 股东万向三农集团有限公司95%的股权。"
鲁伟鼎:“万向信托”至今未发生一笔风险事件,金融界,2018年2月12日,"万向集团董事长、民生保险董事长鲁伟鼎作为民营企业家代表,受邀参加此次民营企业家迎春座谈会,就“助力打好三大攻坚战”建言献策。 鲁伟鼎表示,党中央、习总书记要求“登高望远,居安思危,勇于变革,勇于创新,永不僵化,永不停滞”。中央经济..."
万向鲁伟鼎履新后 第一次公开发言说了啥?,浙江日报,2017年11月16日,座谈会上，省委领导多次以万向为例，对万向给以肯定。鲁伟鼎在会上做了题为《幸福的新时代 创新的新作为》的发言。这也是公布他接任公司董事长后首次公开发言。他在发言中感谢了各级领导对父亲鲁冠球及家人的关心，在会上畅谈了他学习...
万向集团接班人鲁伟鼎:20 余年金融路 独缺证券这张牌,ZAKER资讯,2017年11月10日,"2000 年以来,在鲁伟鼎的带领下,万向获得金融牌照的速度明显加快。自 1992 年任职万向集团副总裁起,当年仅 21 岁的鲁伟鼎将聚焦点放在了金融板块的开疆拓土上。 2001 年中国万向控股有限公司成立,通联资本、万向租赁和通惠期货等与金融相..."
鲁冠球的背影 鲁伟鼎已全面接管万向集团,新华网客户端,2017年10月26日,"万向钱潮上市的1994年,在基层锻炼了多年的23岁的鲁伟鼎被父亲推到了台前,担任万向集团总裁。其后万向发起的多宗并购,鲁伟鼎亲力亲为扮演了主要角色,并在商业实战中逐步完成了对企业的全面接管。"
万向集团总裁鲁伟鼎正式掌舵民生人寿,网易财经,2010年6月29日,"万向集团总裁、民生人寿新任董事长鲁伟鼎 网易财经6月29日讯自今年初泛海退出后,实际持股比例近36%的万向集团终于正式走到了台前。保监会日前公告称,同意万向集团总裁鲁伟鼎担任民生人寿董事长。"
万向集团总裁鲁伟鼎正式掌舵民生人寿,网易财经,2010年6月29日,"万向集团总裁、民生人寿新任董事长鲁伟鼎 网易财经6月29日讯自今年初泛海退出后,实际持股比例近36%的万向集团终于正式走到了台前。保监会日前公告称,同意万向集团总裁鲁伟鼎担任民生人寿董事长。"
鲁伟鼎扩容万向千亿金融版图:筹建上海科创银行 申请设立证券...,新京报,2018年2月9日,据招股书，万向控股旗下民生人寿持有浙商银行股权3.58%。　　2014年，万向共同发起了首批民营银行之一的网商银行，其持股比例达18%。此外，万向还通过旗下的承德露露间接持有着承德银行的股份。　　2017年11月，鲁伟鼎出任万向集团公司...
鲁冠球的万向集团全被“捐”了!涉及4家上市公司 对应市值超100亿,东方财富网,2019年7月15日,"2017年10月25日,72岁的鲁冠球辞世,同年11月,其膝下唯一的儿子、46岁的鲁伟鼎接任万向集团公司党委书记、董事长。 “财散则人聚、财聚则人散,取之而有道、用之而同乐”,这是鲁冠球生前的口头禅,鲁伟鼎不仅继承了父亲在慈善等方面..."
万向钱潮、顺发恒业公告:万向集团被“捐”不导致公司实控人变化,东方财富网,2019年7月15日,"7月15日午间,万向钱潮(000559)、顺发恒业(000631)双双发布公告,称万向实际控制人、董事长兼CEO鲁伟鼎日前宣布将万向集团公司截至2018年度审计报告的资产全部捐赠设立鲁冠球万向事业基金的事项,不会导致公司经营方向与战略发展、经营决策机制等..."
一家乡镇企业成长为跨国公司的传奇——万向集团从田野走向世界,搜狐网,2018年8月15日,"在一个激荡伟岸的时代,万向勇敢地搏击着,奋斗着。34年后,创业49周年前夕,接棒万向集团董事长的鲁冠球之子鲁伟鼎宣布:“万向要从出发的地方集聚全球优秀的科学家、创新者、创业者,打造一座‘高质量、竞争力、现代化’的万向创新聚能城。"
顺发恒业:万向集团公司申请豁免要约收购义务获核准,同花顺财经,2020年1月7日,"据悉,上述事项完成后,顺发恒业控股股东为万向集团公司,实际控制人仍是鲁伟鼎。 来源: 中证网 作者最新文章 科创板元年谁分食了60亿发行费用大蛋糕 今年春运首趟“支南列车”抵达广州 美国众议院议长:美国和世界承受不起战争 相关文章 ..."
【聚焦】全国非公经济人士优秀建设者名单公示 鲁伟鼎章华妹等浙江...,搜狐网,2019年8月1日,"小编查看中央统战部等官网,浙江有多名非公有制经济人士入选,包括万向集团公司董事长兼首席执行官鲁伟鼎、网易(杭州)网络有限公司首席执行官丁磊、宁波杉杉股份有限公司董事局主席郑永刚、天能集团股份有限公司董事局主席兼总裁张天任、浙江润兰..."
鲁伟鼎成为中国首善,搜狐网,2019年7月13日,"7月8日,“万向创业五十周年会议”上,万向集团董事长、CEO鲁伟鼎在讲话中,发布成立一个新的慈善信托——鲁冠球万向事业基金,捐出万向集团公司截止2018年度审计报告的资产。 鲁伟鼎说: 我代表万向董事局,代表家人,也代表万向员工,代表万向..."
鲁伟鼎:最好的传承,ZAKER资讯,2019年2月28日,"在继承企业和财富之余,鲁伟鼎用慈善规划为家族传承做出了最好的选择。 鲁伟鼎 万向集团公司董事长、CEO 撰文:谢舒 来源:《中国慈善家》2019 年 3 月刊 鲁伟鼎向来低调。作为万向系的少东家,他很少出现在公众视野,甚至 "" 鲁冠球三农扶..."
全国民营企业家座谈会上 鲁伟鼎跟主席说了啥?,搜狐网,2018年11月2日,"今年是鲁伟鼎全面接管万向集团的第一年,在11月1日上午举行的全国民营企业家座谈会上,万向集团董事长、首席执行官鲁伟鼎作为10位企业家代表中的其中一员,就新形势下支持民营企业发展提出意见和建议。值得注意的是,他是浙江唯一发言的企业家..."
"接棒不到2年,鲁伟鼎就把父亲的企业都“捐”了? | 小巴看一周",搜狐网,2019年7月13日,"鲁伟鼎属猪,今年是他的本命年。 今年也是他父亲鲁冠球创建万向集团的第50个年头。 7月8日,在万向“生日”当天,鲁伟鼎在50周年会议上郑重宣布了一件事: 将万向集团公司截止2018年度审计报告的资产,全部捐赠鲁冠球万向事业基金。 其实并非..."
吴小晖、鲁伟鼎、宋卫平,网易订阅,2019年7月12日,"7月8日,“万向创业五十周年会议”上,万向集团董事长鲁伟鼎宣布成立鲁冠球万向事业基金,捐出万向集团公司截止2018年度审计报告的资产。 鲁伟鼎说:我代表万向董事局,代表家人,也代表万向员工,代表万向,依照万向创始人、董事局主席、我的父亲..."
万向集团架构生变:董事局取代万向经理人发展责任激励会,东方财富网,2019年3月28日,"鲁伟鼎全面执掌万向一年多之后,万向系股权架构再次调整,这次的调整是万向集团本身。 3月27日,万向系上市公司万向钱潮披露2018年年报。新京报记者发现,万向集团已由万向集团公司董事局100%控制,董事局背后则又是鲁伟鼎本人。"
鲁伟鼎:最好的感恩是奋进,浙江在线,2019年1月6日,"浙江在线1月6日讯(浙江在线记者 章卉)2018年12月18日,在庆祝改革开放40周年大会上,万向集团创始人、原董事局主席鲁冠球被授予改革先锋称号,颁授改革先锋奖章。万向集团董事长鲁伟鼎代表父亲领取了沉甸甸的奖章。他说:“这是对家父一生奋..."
鲁伟鼎:其父其子 万向的二代强人,华夏时报,2018年3月2日,2017年11月3日下午，万向集团董事局召开特别会议，一致通过实际控制人鲁伟鼎为万向集团公司法定代表人，担任董事长、首席执行官。当天，作为鲁冠球唯一的儿子，万向集团的公司法定代表人变更为鲁伟鼎。两个时代的传承 尽管任何一段历史都有它...
"银企合作恳谈会鲁伟鼎表示“唯有真实,唯有奋斗”",搜狐网,2018年1月25日,"1月16日、17日、18日,万向分别与国家开发银行浙江省分行、中国建设银行浙江省分行、交通银行浙江省分行举办银企合作恳谈会。银企热情互动,诉说友谊,共谋发展。万向集团公司党委书记、董事长鲁伟鼎在恳谈会上表示,“幸福是奋斗出来的。” ..."
"刚刚,万向集团有了接班人。。。",搜狐网,2017年11月5日,"11 月 3 日,万向集团董事局召开特别会议。经万向集团董事局会议选举产生,一致通过实际控制人鲁伟鼎为万向集团公司法定代表人,担任董事长、首席执行官。 会议决定,万向集团董事局主席职务的称谓作为对创始人鲁冠球同志的尊称和纪念,将被永久..."
万向集团董事长鲁冠球去世 以491亿财富位列2017胡润百富榜第37位,前瞻网,2017年10月25日,"如今,万向系员工人数超过4万名,总营收破千亿,盈利超百亿,还拥有遍布亚、美、欧、非的庞大非上市产业集群。 据企业查询宝相关工商资料显示,万向集团公司成立于1990年,法定代表人为鲁冠球,注册资本45,000(万人民币)。万向三农集团公司现..."
"【企业】万向集团“走出去”发展战略,受到浙江省委书记车俊褒奖",搜狐网,2017年8月25日,"中国驻芝加哥总领事馆洪磊总领事,商务参赞邹小明、沈祺文领事,上海市浙江青年人才联合会主席、万向集团党委副书记、董事局执行董事、总裁鲁伟鼎,万向美国公司总经理倪频,以及随行代表团成员,一同出席了当日的活动。"
杭州记忆丨万向集团:中国企业常青树,浙江新闻官网,2019年8月31日,"如今,杭州万向节厂已发展成为万向集团公司,是一家现代化跨国企业集团。 万向集团增程式轿车(2015年10月) 它是国务院120家试点企业集团和全国520户重点企业中唯一的汽车零部件企业,是中国向世界名牌进军具有国际竞争力的16家企业之一,被誉..."
鲁伟鼎捐万向全部资产设百亿基金 未涉金融板块资产,手机凤凰网,2019年7月18日,"7月15日,上市公司万向钱潮(000559.SZ)、顺发恒业(000631.SZ)发布公告称,万向实际控制人、董事长兼CEO鲁伟鼎宣布,捐出万向集团公司截至2018年度审计报告的全部资产,设立鲁冠球万向事业基金。"
"十年合计捐赠80亿!牛根生、鲁伟鼎、许世辉,谁是食品行业“首善”?",搜狐网,2019年6月3日,"2017年10月,74岁的鲁冠球去世。此后,万向系三大核心平台——万向三农集团、万向集团公司及万向控股集迎来了新掌门人,“鲁伟鼎家族”代替“鲁冠球家族”出现在各个文件上。 回顾鲁冠球一生,堪称传奇。1969年,鲁冠球变卖所有家产,筹集了4000元..."
封面人物 | 鲁伟鼎:用慈善规划为家族传承做出选择,搜狐网,2019年5月27日,"1994年,鲁冠球任命23岁的鲁伟鼎为万向集团总裁。1999年,鲁伟鼎飞赴美国哈佛商学院读书,回国后继任集团总裁。 接手万向集团之后,鲁伟鼎在企业运营、金融及资本运作上“长袖善舞”,也取得了亮眼的业绩,包括主导成立通联资本、万向租赁、通联期..."
鲁伟鼎在京会见美国麻省理工学院莱夫校长,搜狐网,2018年5月17日,"4月27日, 万向集团董事长、首席执行官鲁伟鼎与应邀来访的美国麻省理工学院校长拉斐尔·莱夫(L.Rafael Reif)在北京万向民生大厦举行午餐会,双方就在杭州万向创新聚能城共建高等研究院事宜进行了亲切友好的会谈,对创新聚能城建设及其在万向总体..."
"时隔14年再次召开的全省开放大会上,马云、鲁伟鼎代表浙商发言...",搜狐网,2018年5月9日,"5月9日,浙江举行全省对外开放大会。这是时隔14年后浙江再次召开全省对外开放大会。 会上,浙商总会会长、阿里巴巴集团董事局主席马云,万向集团董事长鲁伟鼎作为浙商的代表进行了发言。以下是他们的发言内容: ..."
鲁伟鼎接手承德露露 营收净利润双降待破局,证券之星,2018年3月27日,3月20日，承德露露发布了《关于公司实际控制人变更的公告》。公告显示，鲁冠球之子鲁伟鼎依法继承了鲁冠球名下万向三农集团有限公司(以下简称“万向三农”)95%的股份。而万向三农则是承德露露的控股股东，持股40.68%。由于此前鲁伟鼎持有...
鲁伟鼎成万向德农实际控制人,证券之星,2018年3月19日,去年10月25日，万向集团创始人、董事局主席鲁冠球因病去世。后经万向集团董事局会议选举，鲁伟鼎成为万向集团法定代表人，并担任董事长、首席执行官。彼时，万向集团表示，公司将沿着鲁冠球生前制订的战略坚持实业稳步前进，依法合理，因时而...
鲁伟鼎管大源关系不和? 万向首次发声:无稽之谈,网易财经,2018年2月8日,"这段文字来自万向集团门口的一个陈旧宣传栏,寥寥几句话,概括了万向帝国创始人身后的权力架构:三人中,鲁伟鼎为鲁冠球之子,倪萍是鲁冠球女婿,管大源则是效力万向四十年的“老人”,也是三人中唯一的非鲁氏家族成员。"
巨人的陨落 万向集团董事长鲁冠球逝世,电车之家网,2017年11月30日,"据国内媒体报道称,10月25日上午,万向集团董事长鲁冠球逝世,享年72岁。1945年出生的鲁冠球是第一代浙商群体中的“教父级”人物,被冠以民营企业家中的“常青树”,曾被《福布斯》称为汽车零部件领域的“全球领袖”,为福特、通用等全球汽..."
"著名浙商万向集团董事长鲁冠球先生昨日逝世,他的梦想是造中国人...",搜狐网,2017年10月26日,"万向集团旗下的万向资源有限公司持有中色股份1.41亿股,占中色股份总股本的7.14%,最新持股市值约10亿元。 鲁冠球之子鲁伟鼎位列华谊兄弟第七大单一股东,持有2798.83万股。 值得注意的是,天赐材料、海利得也与万向系企业关系匪浅。"
万向集团董事长鲁冠球72岁辞世 两年前曾称没有退休计划,财新,2017年10月25日,"【财新网】(记者 安丽敏 张而弛)万向集团创始人、董事长鲁冠球今天(10月25日)因病逝世,享年72岁。 万向集团官网发布讣告确认上述信息,但尚未公布继任者。鲁冠球儿子鲁伟鼎现担任万向集团董事局执行董事、总裁等职务。"
图说万向集团:民营企业中的“不倒翁”鲁冠球,OFweek环保网,2013年10月1日,"与其父的产业梦相比,鲁伟鼎显然对于金融更情有独钟。在万向的金融业版图中,目前已包括民生人寿、浙商银行、通联支付、万向租赁、通联期货、工商信托、浙商基金及万向香港等多个子公司。通过万向财务公司和通联资本两大平台,鲁伟鼎已经悄然将..."
