title,source,time,summary
"曾身处国内疫情中心,东风公司是如何危中寻机持续高质量发展的?",A汽车很听话,2020年8月4日,“‘新基建’和东风公司提出的汽车‘五化’趋势高度吻合。我们在这方面做产品开发和试验，也是想在‘新基建’中抢抓机遇。”竺延风表示。可以预见的是，接下来以大数据、云计算、物联网、人工智能、5G等为主导的“新基建”将迎来巨大的...
"特别策划之东风汽车:今年迎大考,是有惊无险还是危机四伏?",阿贵看车,2020年8月3日,东风汽车在新五化尤其是自动化方面频频出击，50周年庆典上东风董事长竺延风就凭借40分钟的自动驾驶刷屏汽车行业圈。同时，在整合一汽、长安、腾讯等行业巨头的基础上成立了出行公司T3、东风GO等，这是东风公司近几年最能拿得出手的战略思考...
东风发布岚图汽车品牌战略首款概念车亮相,东方财富网,2020年7月31日,东风汽车集团有限公司董事长、党委书记竺延风表示，岚图已制定了未来3-5年的发展规划，实现覆盖轿车、SUV、MPV以及跨界车、高性能车等各个细分市场，并且将从2021年起，每年将向市场投放不少于一款新车型。据岚图汽车CEO卢放介绍，岚图...
"一汽、东风、长安7个月上演7次重大人事调整,预示着什么?",功夫汽车精选,2020年7月31日,而在3月，东风汽车集团更是宣布了一系列干部任免通知：3月31日，东风汽车集团召开干部任免会议，东风公司董事长、党委书记竺延风远程参会并讲话，宣布东风汽车有限公司副总裁丁绍斌出任东风乘用车公司总经理；兼任东风乘用车公司总经理不足...
抗疫复工勇担当加速转型开新局 东风公司持续推动高质量发展,新华网客户端,2020年7月27日,“在武汉、十堰等地医疗物资告急的时候，东风公司毫无保留地将防护物资捐给医院，东风员工也展现了极强的大局意识。”东风公司董事长、党委书记竺延风说。疫情中，东风公司不仅携旗下企业捐助近1.05亿元的款物，更在离汉通道关闭期间，...
岚图落地强调独立姿态 东风高端化迎一年倒计时,经济观察报,2020年7月24日,今年5月，在疫情对东风的影响初缓之时，东风汽车董事长竺延风给h事业部员工一封信的公开，让h品牌正式走入公众视野。对于岚图汽车科技有限公司的“四新”——全新战略、全新组织机制、全新商业模式和全新团队，东风方面解读称，“在创新的...
用三至五年打造中国第一、世界一流创新型汽车高科技企业 四个关键...,中国江苏网,2020年6月30日,中国第一汽车集团有限公司董事长徐留平说：“汽车‘四化’到了最关键时刻，协力推动中国汽车产业转型升级，时不我待。”东风汽车集团有限公司董事长竺延风期盼，加速起航，快结硕果，共同打造未来核心竞争力。挂出“作战图”，协同创智未来 ...
突发!东风汽车一高管涉嫌严重违纪违法被查!,网易订阅,2020年6月29日,"五年前,竺延风接管的东风汽车刚刚经历一轮深度反腐,集团上下人心惶惶。和五年前的反腐不同,此次东风集团调查范围以由高层团队向研发版块扩大。此次周旺生被查,意味着东风集团内部反腐在继续蔓延,后续或许有更多的人员被查。"
增速跑赢大市 东风公司生产经营持续向好,中国经济网,2020年6月16日,“作为企业，一定要紧盯市场新的发展趋势与模式，在高质量发展的前提下，能够更加适应新的市场消费模式，提供更加符合客户需求、更好产品质量、更高性价比的产品。”竺延风表示。全面复工复产以来，东风公司克服疫情影响，快马加鞭，密集推出...
竺延风委员:推广无人配送车,中国财富网,2020年5月25日,（原标题：《竺延风委员：推广无人配送车解决配送“最后一公里”难题》）全国政协委员，东风汽车集团有限公司董事长、党委书记竺延风近日接受人民网记者采访时表示，今年他将重点关注物流配送方面的议题，并带来了积极推广应用无人配送车辆的...
"两会,汽车行业的代表和委员们这么说",易车网,2020年5月24日,"随着互联网基础设施的完善、移动互联网技术和人工智能的发展,无人配送车为解决配送“最后一公里”难题提供了一种有效的方案。 为此,全国政协委员,东风汽车集团有限公司董事长、党委书记竺延风建议:在政策上,鼓励发展无人配送车辆。把无人..."
东风h:将打造另一种造车新势力,新华网客户端,2020年5月22日,2019年，东风h事业部正式成立，专注高端新能源乘用车领域，开启了东风未来10年最重要的战略布局。5月6日，东风汽车集团有限公司董事长、党委书记竺延风一封致东风h事业部的信让东风h品牌再次来到聚光灯下。按原计划，东风h品牌应该在4月...
卢放领衔 h事业部 东风高端之路喜忧参半,网易订阅,2020年5月15日,"自本月6日东风汽车集团有限公司董事长、党委书记竺延风给h事业部员工的一封信被曝光后,东风新能源高端品牌h事业部领导班子的敲定使得这一全新品牌再度进入众人眼光。 对于东风而言,h事业部显然是一条不得不走的路。目前东风旗下自主品牌..."
王忠林调研东风公司并召开座谈会 全力支持企业在汉做大做强,武汉发布,2020年4月22日,东风汽车集团有限公司董事长、党委书记竺延风参加调研并主持座谈会。座谈会前，王忠林、周先旺了解东风公司发展历程，察看特种车、卡车、乘用车等车辆，体验5G无人驾驶车，询问企业研发技术创新、零部件配套等情况，指出要加大对燃料电池、新...
王忠林走访调研重点车企:加快经济社会发展“重启恢复”,武汉发布,2020年3月29日,确保我市社会经济平稳健康发展。东风汽车集团董事长竺延风、总经理李绍烛，市委常委胡亚波、龙良文、彭浩参加调研。长江融媒出品 记者：郑汝可 编辑：马梦娅 校对：张纯 来源 | 长江日报 编辑 | 司琪 文章经授权发布 转载请注明出处 ...
东风抗疫实录,经济观察报,2020年3月4日,而对于这两重身份的转换，东风汽车集团在疫情爆发一开始就做好了准备。在武汉1月23日宣布封城之前，东风汽车集团有限公司董事长、党委书记竺延风作出一个决定：留在武汉，而非返回长春的家。大帅稳坐中军帐，这成为东风能够快速应对疫情，...
东风公司:全力以赴 为打赢抗疫阻击战和经济保卫战提供坚实支撑,同花顺财经,2020年3月1日,东风公司董事长、党委书记竺延风指出，要实事求是分析定性各单位面临的形势，因地制宜，因企施策，机动灵活，在有完善的防护措施前提下，稳妥有序开展工作，决不能“一动不动”，疫情防控和生产经营两者都不可偏废。自2月份以来，东风...
“新东风”:在全球汽车业变革新起点上开启新征程,新华社客户端,2019年11月15日,"竺延风说,如果把前50年的从无到有,看作是东风汽车为生存而战的征程,那么站在全球汽车业变革的新起点上,虽然身处一个充满未知和可能性的变革时代,难以预测出谁是最后的赢家,但至少在开启下一段航行前,东风汽车已开始蓄力,并为此做好..."
50岁的东风集团迎来了第1800万辆汽车下线,界面新闻,2019年10月6日,"就在东风自主品牌第1800万辆暨东风商用车第600万辆下线的第二天,也就是9月28日,东风公司迎来了自己的50岁生日。在当天举办的庆祝大会上,东风公司董事长、党委书记竺延风提出了“三个领先、一个率先”的战略目标。截至目前,东风公司..."
东风公司举办“传承马灯精神、永葆青春活力”主题活动,新华网客户端,2019年9月30日,"东风公司董事长、党委书记竺延风,东风公司总经理、党委副书记李绍烛,东风公司董事、党委副书记程道然,东风公司工会主席何伟与青年员工代表共同参与活动。 “马灯闪耀东风劲——传承马灯精神、永葆青春活力”主题活动现场 孕育·马灯之光起深山 ..."
"50载风雨征程,东风公司把人们对美好出行生活的向往,扛到了肩上",汽场,2019年8月27日,"东风公司董事长、党委书记竺延风表示,“尽管东风诞生在大山里,但我们不能‘蹲在山沟里想问题’,要‘站在山巅看世界、想未来’。” 在汽车产业急剧变化的今天,站在山巅看世界的东风公司意识到,汽车产业已经进入全新发展阶段,必须加速布局..."
一汽、东风、长安 三央企的战略合作与人事交流|汽车热点脉络,搜狐网,2019年7月24日,"从2015年徐平北上、竺延风南下开始,一汽集团、东风集团、兵装集团(长安集团母公司)开始了频繁的高层人事调整,再加上三大车企间愈加深入的战略合作,以至于坊间流传出“三企合一”的传闻。关注该事件,将为您带来三大央企战略合作及人事交流的..."
"@东风青年,竺延风有话对你说",搜狐网,2019年5月6日,"▲东风公司董事长、党委书记竺延风,东风公司工会主席何伟,东风公司团委书记师建兴,东风公司2018-2019年度“十大青年明星”,东风公司优秀青年代表及2018年度优秀团员代表等参加座谈会。 竺延风寄语青年 ..."
"东风、华为与湖北省襄阳市联手,打造国家智能网联汽车示范区",澎湃新闻,2019年4月3日,"东风公司党委常委、副总经理尤峥,襄阳市政府副市长李德璋,华为汽车行业解决方案部总经理何利扬共同签署协议,东风公司党委书记、董事长竺延风,湖北省委常委、襄阳市委书记李乐成,华为副总裁张顺茂,襄阳市委副书记、市长郄英才,东风公司战略规划部..."
"董明珠说中国汽车不行,竺延风/魏建军纷纷回怼,谁的话可信?",麻辣车事号,2019年3月8日,"看到董明珠的这一番言论,汽车圈的大佬怎能忍气吞声呢?3月5日,东风汽车公司董事长竺延风针对董明珠的言论回应道,“我反正没有造电器,我说不出电器。但我负责地说, 中国汽车制造水平是世界水平。” 与此同时,一向低调的长城汽车掌门人魏..."
"今早,张维国竺延风一声令下,十堰全城沸腾了!",搜狐网,2019年1月5日,"湖北省政协副主席、十堰市委书记张维国,东风汽车集团有限公司董事长、党委书记竺延风,十堰市委副书记、市长陈新武,东风汽车集团有限公司总经理、党委副书记李绍烛共同点亮马灯。 张维国、竺延风 双双举起发令枪 ..."
"今早,张维国竺延风一声令下,十堰全城沸腾了!",搜狐网,2019年1月5日,"湖北省政协副主席、十堰市委书记张维国,东风汽车集团有限公司董事长、党委书记竺延风,十堰市委副书记、市长陈新武,东风汽车集团有限公司总经理、党委副书记李绍烛共同点亮马灯。 张维国、竺延风 双双举起发令枪 ..."
王传福、李书福、竺延风、徐和谊、徐留平等祝贺WEY品牌两周年,车市博览,2018年12月11日,"在品牌之夜最为震撼的时刻,五大中国汽车企业掌门人比亚迪股份有限公司董事局主席兼总裁王传福、吉利控股集团董事长李书福、东风汽车集团有限公司董事长兼党委书记竺延风、北汽集团董事长兼党委书记徐和谊、一汽集团董事长兼党委书记徐留平(以姓氏..."
东风汽车《加油!向未来》第三季将首播 风神全新车型亮相,中国新闻网,2018年8月3日,“汽车产品未来的发展，会把当今的各种最新技术集成在一个产品当中，并且运动地让大家体验。中国有句话叫做自古安居乐业，现在就是‘动’居乐业，你家里有的，汽车里都有。”东风公司董事长、党委书记竺延风说。科技创新大潮澎湃，千帆...
一汽澄清关于“一汽、东风、长安整合”传闻,每日经济新闻,2018年7月18日,上述两个传闻版本截止记者发稿时，均未得到东风、长安方面的承认。事实上，自2015年竺延风前往东风，徐平调任一汽后，有关三大央企汽车集团的合并传闻便从未间断。近三年来，一汽、东风、长安三家车企高管频繁换防，也加大了业内对这三家...
"全揭秘,2018两会代表委员用什么方式关注氢燃料汽车 (下)",中国客车网,2018年3月13日,"2018年2月成立的国家队的中国氢能源和燃料电池汽车产业创业新联盟核心成员之一,就有一汽集团。 东风汽车公司党委书记、董事长竺延风 全国政协委员、东风汽车公司党委书记、董事长竺延风领导下的东风汽车,是中国四大汽车集团之一。资料显示,东..."
东风系高管离职频繁 成汽车行业最大人才输出方,搜狐网,2018年2月13日,"此外,由于国内汽车市场竞争日趋激烈,国有企业由体制和规模带来的竞争优势不断削弱,竺延风入主东风后也加快改革,进行了大面积人事调整。在这一阶段调整中,东风启辰汽车公司宣告成立,周先鹏调任东风启辰汽车公司总经理;安铁成接替刘卫东担任神..."
"实现品牌向上发展,东风公司“走出去”意义非凡",车业杂谈,2018年2月9日,“一带一路”是推动世界经济发展的伟大倡议，它不仅为我国汽车产业“走出去”提供了从政策背景、贸易环境到资金、文化等各方面的支持，同时也让有实力且想要“走出去”的企业更加信心十足。如东风公司董事长、党委书记竺延风所言：“国际...
"东风定450万辆目标,2018着力新能源和自主品牌",汽车头条,2018年1月23日,"更多的消息是,东风乘用车全年共计投放了20多款新车型,中高端车型的销量比例增加了5.5%,SUV占比增加了7.1%,而尤其是包括牵引车在内的重卡销量占比有所提升。 ▲东风公司董事长、党委书记竺延风 ..."
"一汽、东风、长安抱团发展,专家:比起“合并”更像“试婚”",澎湃新闻,2017年12月3日,左起：中国第一汽车集团公司董事长、党委书记徐留平，东风汽车集团有限公司董事长、党委书记竺延风，中国兵器装备集团公司党组书记、董事长徐平。三方抱团，四个方面谋求合作 三方宣布，将在前瞻共性技术创新、汽车全价值链运营、联合出海“走出...
乘着东风的翅膀 愿你飞得更高,搜狐网,2017年11月13日,"“地主”的豪情不仅是以董事长竺延风率领的东风汽车公司从上到下齐助阵,东风商用车、东风股份、东风特商、东风柳汽、东风零部件等“清一色”驻场的霸气,也是东风商用车展会传来“销售46辆卡车、获得248个意向客户”的收获喜悦,品牌传播..."
