title,source,time,summary
杨青:竺延风新搭档 东风汽车第六任总经理,汽势传媒,3月1日,去年7月份升任东风汽车集团有限公司董事、党委副书记。目前，东风汽车领导班子的具体分工还没有明确对外公布。按照此前的分工情况来看，东风公司董事长、党委书记竺延风负责公司董事会和党委全面工作。前东风公司总经理、党委副书记李绍烛负责...
郄英才与东风汽车集团有限公司董事长、党委书记竺延风座谈,湖北身边的事,2月7日,襄阳将进一步完善对东风汽车集团有限公司在襄企业的服务机制，加大支持力度，更好更精准地提供服务，与东风同频共振，共同促进发展，全力支持东风襄阳基地“十四五”期间实现新跨越。竺延风感谢襄阳市委、市政府长期以来对东风汽车集团有限公司...
"两会专访丨东风公司董事长竺延风:科技公司入局,对传统车企而言是...",每日经济新闻,3月10日,在今年两会期间，竺延风带来了关于优化智能网联汽车发展环境，积极创造商业化落地条件的建议，为推动智能网联汽车产业发展建言献策。东风汽车集团有限公司董事长、党委书记竺延风（图片来源：企业供图）建议创造智能网联汽车商业落地条件 在新一...
竺延风:东风有限是东风的“擎天柱”,腾讯网,1月20日,"1月20日,东风汽车有限公司2021年党委扩大会以线上线下相结合的形式召开,全面总结东风有限2020年生产经营管理、党建思想政治工作,深刻分析东风有限面临的新形势,安排部署2021年各项工作。 东风公司党委书记、董事长、东风有限董事长竺延风在主..."
【东风公司领导班子成员调整:陈昊任副总经理、党委常委】12月29日...,市商网,2020年12月29日,"【东风公司领导班子成员调整:陈昊任副总经理、党委常委】12月29日,东风汽车集团有限公司对外发布消息称,陈昊任东风汽车集团有限公司副总经理、党委常委。当日,东风公司召开领导班子(扩大)会。受中组部委托,东风公司董事长、党委书记竺延风宣布..."
2020中国5G+工业互联网大会丨东风汽车集团有限公司董事长竺延风...,腾讯网,2020年11月20日,"“在数字化浪潮驱动下,汽车产业正在发生前所未有的巨大变化。”在日前举办的2020中国5G+工业互联网大会上,东风汽车集团有限公司董事长竺延风发表了演讲。他表示,我国正在从“制造大国”迈向”制造强国”,汽车产业是我国制造业转型升级的一..."
东风汽车竺延风:数字化时代汽车企业正从卖产品向卖服务转变,新京报,2020年11月20日,新京报贝壳财经讯（记者 陈维城）11月20日，2020中国5G+工业互联网大会在武汉举行，东风汽车集团有限公司董事长竺延风在“数字化赋能汽车产业持续发展”的演讲中提到，数字化时代同时催生了新的商业模式，汽车企业加速从传统的产品制造商，向...
东风汽车竺延风:推动高质量平衡发展,腾讯网,2020年9月5日,"在上午举办的“政策与市场双驱动下的业态重构”开幕大会上,东风汽车集团有限公司董事长、党委书记竺延风发表了精彩演讲,以下为演讲实录: 今天的泰达论坛全新定位为智库论坛,以产业消费双升级、重构生态新格局为主题,具有很强的现实意义。听..."
“岚图”汽车品牌发布 东风汽车和竺延风 到底谁更需要它?,车快评新媒体,2020年8月3日,2015年，竺延风成为东风汽车的当家人，已经年近60岁的他也许是想在任期内，为东风汽车的发展开创新的篇章。如果岚图汽车大获成功，那么他的成就将会永远载入东风汽车的史册，成为传奇。如此看来，无论是东风汽车，还是竺延风，都需要“岚...
东风访谈 | 东风汽车集团有限公司董事长、党委书记竺延风:岚图是...,封面新闻,2020年7月30日,"长江网7月29日讯(记者康鹏)7月29日21时30分,在东风岚图发布会后,东风汽车集团有限公司董事长、党委书记竺延风接受了媒体现场采访。他表示,岚图概念车发布,是东风的新起点、新征程,将引领东风品牌向上。"
「新时代企业家」东风汽车竺延风:新基建+汽车=?,网易订阅,2020年6月16日,"东风汽车集团有限公司董事长、党委书记竺延风 面对重大产业发展机遇,东风汽车加快供给侧结构性改革,狠抓市场、升级产品和服务,构建可以满足美好出行需求的智慧交通生态体系,担当新基建的实践者与推动者。今年两会期间,竺延风针对物流配送 “最后..."
专访东风汽车竺延风:关键“卡脖子”技术和部件要本土化,新京报,2020年5月29日,”近日，全国政协委员、东风汽车集团有限公司董事长、党委书记竺延风在接受新京报记者采访时如是说。不过，在他看来，国家出台的扩大消费政策还将会对市场恢复起到积极作用，并且在一定程度上带动整个市场循环加速和转型升级。东风公司将充分...
"...东风公司董事长竺延风:优化发展环境,推进智能网联汽车商业化落地",工人日报,3月10日,工人日报客户端记者 邹明强 全国政协委员、东风汽车集团有限公司（简称“东风公司”）董事长、党委书记竺延风，政协会上提交了《关于优化智能网联汽车发展环境 积极创造商业化落地条件的建议》，为推动智能网联汽车产业发展建言献策。竺延风指出...
"东风汽车董事长竺延风:今天就不念稿了,说说红海和“蓝皮书”",潇湘晨报,2020年8月11日,“汽车要做‘变形金刚’，做‘魔方’!”11日，2020第十二届中国汽车蓝皮书论坛开幕，东风汽车集团有限公司董事长、党委记竺延风脱稿做主题演讲时，这样表述他对下一代汽车的“梦想”。东风汽车集团董事长、党委书记竺延风发言。 记者 任勇 ...
"东风""打虎""追踪:两名高管落马,竺延风首度表态",网易订阅,2020年7月2日,"汽车头条APP注意到,同日,就在竺延风参加越野车事业部干部大会之际,东风的官方媒体——东风汽车报刊发了一则评论员文章,文章中振聋发聩地提到,“当下东风公司的反腐败斗争形势依然严峻复杂,反腐震慑效应还未完全形成,风清气正的政治生态..."
东风汽车股份有限公司2020年度报告摘要,网易订阅,3月30日,"东风汽车股份有限公司(以下简称“公司”)第六届董事会第四次会议通知于2021年3月2日以邮件的方式送达全体董事。本次董事会会议于2021年3月26日以现场与通讯会议相结合的方式召开。本次会议由董事长赵书良先生主持,应当出席本次会议的董..."
陈昊任东风汽车集团有限公司副总经理,北京商报,2020年12月29日,2020年12月29日，东风汽车集团有限公司（以下简称东风公司）召开领导班子（扩大）会。受中组部委托，东风公司董事长、党委书记竺延风同志宣布了中组部关于干部任职的决定：陈昊任东风汽车集团有限公司副总经理、党委常委。相关职务任免按有关...
东风汽车集团有限公司领导班子成员调整,西迁人,2020年6月12日,6月12日，东风汽车集团有限公司召开领导班子（扩大）会。受中组部委托，东风汽车集团有限公司董事长、党委书记竺延风同志宣布了中组部关于干部任职的决定：乔阳任东风汽车集团有限公司副总经理，不再担任东风汽车集团有限公司总会计师职务；...
竺延风很重视的东风全新高端品牌岚图有成功的希望吗?,对话汽车人,2020年7月21日,岚图品牌是东风汽车向高端品牌的又一次冲锋，同时也弥补了东风汽车在新能源领域的空白，毫无疑问，这对东风汽车集团来说意义重大，就连东风汽车集团有限公司董事长、党委书记竺延风也高度重视。但实实在在地来看，东风全新高端品牌岚图有...
竺延风:东风在鄂企业年内可恢复常态,荆楚网,2020年11月20日,"湖北日报讯(记者周三春、肖丽琼)11月20日上午,中国5G+工业互联网大会“5G+工业互联网”技术前沿与产业发展专题会议举行。东风汽车集团有限公司董事长竺延风以“数字化赋能汽车产业持续发展”为题演讲。"
东风集团竺延风——把握产业变化 促进平衡发展,搜狐网,2020年9月6日,"9月5日,东风汽车集团有限公司董事长、党委书记竺延风在2020中国汽车产业发展(泰达)国际论坛上作了题为《把握产业变化 促进平衡发展》的演讲,提出了多方面的重要观点。 01 当前,我国汽车产业告别高速增长的时期,到了平稳发展的阶段,产业生..."
东风竺延风:产品研发要把握好节奏 落后一步等死、领先两步也可能...,腾讯网,2020年9月4日,"在产品和研发投入上把握好节奏,落后一步是等死,领先两步有时候也成为烈士,最好要保持领先市场需求。 打开腾讯新闻,查看更多图片 > 9月5日,东风汽车集团有限公司董事长、党委书记竺延风在2020中国汽车产业发展(泰达)国际论坛上表示,中国..."
东风集团股份(00489)提名竺延风、李绍烛及尤峥为执行董事,金融界,2020年9月10日,来源：智通财经网 智通财经APP讯，东风集团股份(00489)发布公告，由于公司第四届董事会任期已届满，根据《中华人民共和国公司法》及《东风汽车集团股份有限公司章程》的有关规定，经控股股东推荐、董事会提名委员会审查并提出推选建议，公司...
"今天,东风公司迎来两波朋友",网易,2020年11月27日,"公司董事长、党委书记竺延风,公司总经理助理、东风汽车有限公司执行副总裁周先鹏,公司总经理助理、东风汽车有限公司副总裁陈昊在公司总部会见了邢翔、罗干政一行,双方就抓牢疫情防控不放松与加强区域经济发展并进形势下的互利合作问题进行交流。"
东风公司表彰榜样 首次评出十大“东风工匠”,网易订阅,2月4日,"东风汽车集团有限公司首次评出“东风工匠”,并为每位“东风工匠”颁发价值20万元的奖励,其中包括东风风神AX7 PRO汽车一辆,以表彰他们对东风作出的突出贡献。 东风汽车集团有限公司董事长、党委书记竺延风向受表彰的先进集体和个人表示祝贺。他..."
"一年连升三级,陈昊有望主政东风汽车集团?",网易订阅,2月13日,"带领东风日产进入“销量百万俱乐部”的陈昊又双叒升职了。 12月29日上午,东风公司召开领导班子(扩大)会议,东风公司董事长竺延风在会上宣布了最新的人事任命:原东风公司总经理助理、东风有限副总裁、东风日产副总经理陈昊升任东风汽车集团有..."
"东风汽车反腐,再曝重磅消息!",网易订阅,2020年10月21日,"东风公司董事长、党委书记竺延风也曾表示,“面对腐败问题,公司党委的态度始终是鲜明的,不论什么人、不论其职务有多高、多重要,只要触犯了党纪国法,必将受到严肃追究和严厉惩处。” 东风“反腐”行动连出重拳,东风汽车集团该有多少人如坐..."
竺延风的“加减乘除”,功夫汽车精选,2020年5月13日,综合起来，东风乘用车的总销量目前仅占整体销量的14%左右，这一数字在竺延风看来，显然还不足够。4月7日，东风汽车有限公司任命陈昊任东风有限副总裁，除现有的东风日产工作不变外，还兼管东风启辰的工作。而就在此一周之前，东风集团...
竺延风:冬天熬过去还有春天,国际在线,2020年8月15日,"论坛首日,东风公司董事长、党委书记竺延风作了题为《增强“练冬”本领,迎接新的春天》的演讲,对中国汽车产业的现状和未来蓝海市场进行了阐述,并提出“汽车智能的变,不能光脑袋变,还得真实变”,引起了现场嘉宾的共鸣。   针对..."
杨青将出任东风汽车集团有限公司董事、党委副书记,车市红点,2020年7月31日,7月30日，东风汽车集团有限公召开领导班子干部扩大会，集团董事、党委书记竺延风公布了中央关于干部任命的决定。其中，杨青将出任东汽车集团有限公司董事、党委副书记，不再担任东风公司副总经理。程道然不再担任东风汽车集团董事、党委副书记...
"余震不断,东风再祭反腐大旗",网易订阅,2020年10月22日,"其中东风公司商用车销售57.1万辆,领先第二名的北汽福田近5万辆。上述十家企业共销售321.2万辆,占商用车销售总量的74.3%。 东风公司董事长、党委书记竺延风曾表示,面对腐败问题,公司党委的态度始终是鲜明的,不论什么人、不论其职务..."
至少一年一款 “岚图”急补东风高端短板,网易汽车,2020年7月30日,"东风汽车集团董事长、党委书记竺延风 据了解,目前岚图品牌已规划9款车型,覆盖轿车、SUV和MPV等细分市场,旗下首款车型计划于明年正式上市,东风雷诺武汉工厂将负责生产岚图旗下车型,该工厂整车年产能为15万辆。岚图品牌相关负责人对北京商..."
"东风集团:人事如潮水,东风道路长!",网易,3月16日,"而竺延风对于东风商用车寄予的厚望言语可表,他说:“希望东风商用车有限公司新的领导班子不断强化班子建设,坚定信念、充满信心。要有担当、有定力、有创新、有发展;要进一步深化高素质人才队伍建设,进一步凝聚开心工作、快乐生活的员工文化,..."
"东风“内鬼”,还有多少?",网易订阅,2020年9月21日,"竺延风的反腐宣言 另据《东风汽车报》报道,7月1日,东风特种装备事业部(东风越野车有限公司)干部大会以视频方式召开,专门对特种装备事业部推进党风廉政建设和反腐败斗争提出要求,公司董事长、党委书记竺延风出席会议并讲话。"
"神龙,见首不见尾!|竺延风|东风公司|神龙公司|一汽|邱现东|东风...",网易订阅,2020年9月7日,"今年9月,东风汽车集团有限公司、神龙汽车有限公司、东风汽车股份有限公司、东风进出口公司等单位主要领导均进行了相应的调整。 频繁的人事调整背后,竺延风到底打的什么算盘?即便你我皆是棋子,但也架不住来回折腾啊。从棋子到弃子,在领导眼..."
竺延风5天内走访湖北省内三大基地:东风汽车集团复工情况怎么样了?,网易订阅,2020年3月21日,"作为湖北省最重要的央企之一,东风汽车集团带动的湖北省汽车和零部件制造业,是当地的支柱产业。东风集团的复工复产情况备受关注。 据东风汽车集团官方消息,3月14日至3月18日,东风汽车集团有限公司董事长、党委书记竺延风,走访了公司在湖北..."
李乐成会见东风汽车集团董事长竺延风,华夏经纬网,2020年5月6日,"【襄阳政府网消息】5月4日,省委常委、襄阳市委书记李乐成在南湖宾馆会见了东风汽车集团有限公司董事长、党委书记竺延风。 疫情防控期间,我市积极推进东风公司在襄企业惠企政策落实、重大项目奖补政策兑现、新能源汽车推广应用补贴资金兑现等事..."
一将无能 累死三军 东风汽车竺延风的骑虎难下,ZAKER资讯,2019年11月20日,"眼下东风汽车集团还沉浸在 50 周年的庆祝上,但是作为东风汽车集团股份有限公司(以下简称:东风汽车,港股代码:0489)一把手的董事长竺延风,或许要感到很大的压力,留给他的时间似乎不多了。 曾经风光无限,38 岁就成为一汽 "" 少帅 "" 竺延风..."
东风汽车集团有限公司第十一届职工运动会盛大开幕 张维国致贺词...,搜狐网,2019年9月28日,"9月27日上午,以“奋进五十年、卓越创未来”为主题的东风汽车集团有限公司第十一届职工运动会在十堰市体育中心盛大开幕。省政协副主席、市委书记张维国致贺词,东风汽车集团有限公司董事长、党委书记竺延风宣布运动会开幕,东风汽车集团有限公司..."
十堰市与东风汽车集团有限公司举行经济形势通报会 张维国竺延风...,搜狐网,2019年9月27日,"9月26日,十堰市与东风汽车集团有限公司举行经济形势通报会,市企双方畅叙建市建厂50年来的深情厚谊,共谋携手并进的崭新篇章。省政协副主席、市委书记张维国,东风汽车集团有限公司董事长、党委书记竺延风出席并讲话。市委副书记、市长陈新武,..."
竺延风任东风汽车公司董事长,新华网客户端,2015年5月6日,"中共中央组织部干部五局局长毛定之宣布了党中央、国务院关于东风汽车公司主要领导变动的决定:竺延风同志任东风汽车公司董事长、党委书记;免去徐平同志东风汽车公司董事长、党委书记职务,另有任用。"
陈敏尔会见东风汽车集团董事长竺延风、中铝集团董事长葛红林,人民网,2019年10月20日,"竺延风说,重庆是西部制造业重镇,近年来产业升级步伐加快。东风汽车集团愿与重庆一道,抓住汽车产业深度调整的契机,推动合作项目发挥最大效益,助力重庆汽车产业转型发展。葛红林说,中铝集团将以高端制造股份有限公司揭牌运营为新起点,发挥技术、..."
"东风商用车人事调整,竺延风升帐遣将",搜狐网,2016年6月21日,"此外,黄刚不再担任东风商用车有限公司总经理,李京桥不再担任东风商用车有限公司党委书记、委员、副总经理,徐天胜不再担任东风商用车有限公司副总经理。 据了解,东风汽车公司董事长、党委书记竺延风出席了会议并讲话。“这次东风商用车领导..."
东风汽车公司换帅 竺延风接替徐平就任董事长,荆楚网,2015年5月7日,"昨日上午9时许,位于武汉经济技术开发区的东风汽车集团总部大楼会议室,气氛热烈,掌声阵阵——正在召开的干部大会现场,中共中央组织部干部五局局长毛定之宣布了党中央、国务院关于东风汽车公司主要领导变动的决定:竺延风同志任东风汽车公司董事长..."
吉林省委副书记竺延风任东风汽车董事长 曾在一汽工作近25年,观察者网,2015年5月6日,"5月6日上午,东风汽车公司在官方微博发布公告称,竺延风正式担任东风汽车公司董事长、党委书记,免去徐平同志东风汽车公司董事长、党委书记职务。由此传了多日的人事问题终于水落石出。 公告称,5月6日上午东风汽车公司召开中层以上管理人员大会..."
竺延风调任东风汽车 昔日“一汽少帅”重回老本行,人民网,2015年5月6日,"今天上午,国资委官微消息显示,5月6日上午,东风汽车公司召开中层以上管理人员大会。中共中央组织部干部五局局长毛定之宣布决定:任命吉林省委副书记竺延风接替徐平出任东风汽车公司董事长,昔日“一汽少帅”在离开汽车行业7年之后再次回归,执掌了..."
东风汽车换帅尘埃落定 竺延风出任董事长,搜狐网,2015年5月7日,"京华时报讯(记者麦田)昨天,东风集团召开中层以上管理人员大会,中组部宣布一汽集团前任董事长、现任吉林省委副书记竺延风接替徐平出任东风汽车董事长、党委书记;免去徐平同志东风汽车公司董事长、党委书记职务,另有任用。"
传闻成真!竺延风出任东风汽车掌门人,第一财经,2015年5月6日,"竺延风接替徐平出任东风汽车公司董事长、党委书记,徐平则另有任用。徐平则对员工称:“欢迎大家到一汽来看我。” 传闻正变成了现实。今日(6日),在东风汽车公司召开中层以上管理人员大会上,中共中央组织部干部五局局长毛定之宣布党中央、国务..."
竺延风调任东风汽车董事长 两大汽车央企换防?,快科技,2015年5月6日,"最近汽车圈里疯传的小道重磅消息终于在今天上午得到证实,中组部宣布了党中央、国务院关于东风汽车公司主要领导变动的决定:竺延风同志任东风汽车公司董事长、党委书记;免去徐平同志东风汽车公司董事长、党委书记职务,另有任用。"
竺延风出任东风汽车董事长 徐平另有任用,中国网财经,2015年5月6日,"中国网财经5月6日讯 据国资委网站消息,周三上午,东风汽车公司召开中层以上管理人员大会。中共中央组织部干部五局局长毛定之宣布了党中央、国务院关于东风汽车公司主要领导变动的决定:竺延风同志任东风汽车公司董事长、党委书记;免去徐平同志东风..."
中组部正式任命竺延风为东风汽车董事长,中国网,2015年5月6日,"中国网汽车讯5月6日上午,中组部正式宣布现任公司董事长、党委书记徐平离任,另有任用;原吉林省副书记竺延风则正式履新,上任东风汽车公司董事长、党委书记。 竺延风 至此,行业盛传的一汽、东风领导人人事变动的消息终于确定了一半。"
东风汽车公司董事长竺延风:在汽车强国进程中展现作为,中国经济网,2017年11月10日,(原文来源:经济日报 作者:东风汽车公司董事长、党委书记 竺延风)
东风汽车公司领导调整 竺延风任董事长,搜狐网,2015年5月6日,"2015年5月6日上午,东风汽车公司召开中层以上管理人员大会。中共中央组织部干部五局局长毛定之宣布了党中央、国务院关于东风汽车公司主要领导变动的决定:竺延风任东风汽车公司董事长、党委书记;免去徐平东风汽车公司董事长、党委书记职务,另有任..."
"东风汽车董事长竺延风:雄心勃勃,富有挑战",搜狐网,2016年5月16日,"此计划发布会,东风汽车公司董事长、党委书记竺延风发表了一段长达近10分钟的讲话,其中寰球汽车注意到,他用了一句话非常耐人寻味的话来点评:这个计划是雄心勃勃的,也是非常具有挑战性的,要实现绝非易事。"
东风汽车公司董事长竺延风来常考察,常州市人民政府,2016年8月30日,"8月28日、29日,东风汽车公司董事长、党委书记竺延风一行来常州视察东风汽车常州基地以及常州汽车装备业发展情况。 28日下午,市委书记阎立和市长费高云在青枫苑宾馆会见了竺延风一行。29日上午,竺延风一行又在阎立的陪同下,现场察看了风度(..."
竺延风任职东风汽车公司总经理 徐平离任,搜狐网,2015年5月5日,"5月6日上午,东风汽车公司召开中层以上管理人员大会。中共中央组织部干部五局局长毛定之宣布党中央、国务院关于东风汽车公司主要领导变动的决定:任命竺延风为东风汽车公司董事长、党委书记;免去徐平东风汽车公司董事长、党委书记职务,另有任用。"
中央第七巡视组向东风汽车集团有限公司党委反馈巡视情况,中国新闻网,2019年8月3日,"近日,中央第七巡视组向东风汽车集团有限公司(以下简称东风公司)党委反馈巡视情况。中央巡视工作领导小组成员王鸿津主持召开向东风公司党委书记、董事长竺延风的反馈会议,出席向东风公司党委领导班子反馈巡视情况会议,对巡视整改提出要求。会议向..."
东风汽车有限公司举行成立15周年纪念晚会,中国经济网,2018年8月15日,"东风汽车公司董事长、党委书记、东风有限董事长竺延风,公司党委常委、总会计师乔阳,武汉经济技术开发区工委委员、管委会副主任李林以及东风有限老领导、现任领导班子和东风有限干部员工代表、供应商代表、经销商代表欢聚一堂,共同庆祝东风有限成..."
东风汽车有限公司领导班子调整 雷平调离 周先鹏、赵书良接棒,华夏经纬网,2018年5月15日,"该公司总部设在武汉,注册资本167亿元人民币,双方各拥有50%的股份,现任董事长竺延风。 今年4月1日,内田诚接替关润继任东风汽车有限公司总裁,关润升任雷诺-日产-三菱汽车联盟高级副总裁。此次调整前,周先鹏任东风汽车有限公司副总裁、党委..."
东风汽车股份有限公司公告(系列),搜狐网,2019年8月27日,公司名称:东风汽车有限公司 企业性质:有限责任公司(中外合资) 注册地址:湖北省武汉市武汉经济技术开发区东风大道10号 主要办公地点:湖北省武汉市武汉经济技术开发区东风大道10号 法定代表人:竺延风 ...
东风汽车公司改名了!改名前他们还改了这个……,网易新闻,2017年12月1日,"竺延风(东风公司董事长):东风公司是生长于湖北、深受湖北人民支持和厚爱的特大型汽车企业。东风公司将积极推进武汉基地转型升级和持续发展,为武汉打造世界知名“车都”,加快建设现代化、国际化、生态化大武汉,开启湖北“建成支点、走在前列..."
任学锋会见东风汽车公司董事长竺延风一行,广州市人民政府门户网站,2017年7月2日,"日前,广东省委副书记、广州市委书记任学锋在穗会见东风汽车公司董事长、党委书记竺延风,总经理、党委副书记李绍烛一行。任学锋对东风汽车公司为广东、广州经济社会发展所作的贡献表示感谢。他说,汽车产业是广州的支柱产业之一,广州把优化汽..."
