title,source,time,summary
东风汽车公司董事长竺延风为兴山送“东风”,搜狐网,2018年10月17日,"10月16日,东风汽车公司董事长、党委书记竺延风一行到兴山县调研指导对口支援和精准扶贫工作。 竺延风一行先后前往郑万高铁建设现场、爱心公益众筹中心,实地了解高铁建设和扶贫工作开展情况,并到古夫镇深渡河村开展“聚力脱贫攻坚、五级代表在..."
竺延风:把一个什么样的东风带进未来?,ZAKER资讯,2020年1月13日,"回首过往,东风汽车集团有限公司董事长、党委书记竺延风说:"" 在中国汽车工业强起来的历史进程中,把一个什么样的东风带进未来?我们已经做出了阶段性回答。"" 这个答案就是东风汽车拿出了结结实实的业绩回馈了国家。50 年间,东风公司累计产..."
车圈| 竺延风发文首谈h事业部 东风全新高端品牌更多细节曝光,腾讯汽车,2020年5月6日,"[摘要]竺延风透露,h事业部拥有全新的组织、全新的机制及全新的商业模式,并且这将是一个更加年轻化的团队。 5月6日,东风汽车集团有限公司董事长、党委书记竺延风向h事业部全体员工发出了一封内部信。"
"东风日产迎1000万辆整车下线,竺延风出席并致辞",搜狐网,2018年10月23日,"近日,在被誉为雷诺—日产—三菱联盟 “世界级母工厂”的东风日产花都工厂,一辆轩逸·纯电(参数|图片)从生产线上缓缓驶下,宣告东风日产第1000万辆整车下线。作为东风汽车集团有限公司的一把手,东风汽车集团有限公司董事长、党委书记竺延风,..."
东风集团再发人事调整 竺延风实现全面把控,搜狐网,2016年6月21日,"(文/搜狐汽车 杨亚楠)6月20日,近期处于人事变局中的东风集团又有最新变动。东风集团旗下的东风本田、神龙公司与东风商用车三大业务板块分别召开了干部大会,官方新闻公告显示,东风汽车公司董事长、党委书记竺延风均出席了上述会议并作讲话。"
竺延风“动刀”郑州日产: 东风大调整第一波,腾讯汽车,2016年3月1日,"这是竺延风掌管东风以来,对公司业务的最大调整,牵涉面也很广。调整郑州日产涉及到和日产的合资公司东风有限,A股上市公司东风汽车股份,以及在郑州日产工厂生产的东风日产等。 1月21日,竺延风已经会见了郑州市委书记吴天君和市长马懿,表示:“..."
李乐成会见竺延风表示 全力支持东风在襄阳企业复工复产,湖北省人民政府门户网站,2020年3月20日,"3月17日,省委常委、襄阳市委书记李乐成在襄阳会见了东风汽车集团有限公司董事长、党委书记竺延风一行。 李乐成对竺延风的到来表示感谢。他说,东风公司密切关注襄阳防疫,在第一时间捐助了善款和物资,让襄阳人民很受感动和鼓舞,更加坚定了抗击..."
竺延风为东风两项新兴业务授牌!,搜狐网,2020年1月12日,东风汽车集团有限公司 (以下简称“东风公司”) 董事长、党委书记竺延风 为东风公司前瞻技术研究院 和智新科技股份有限公司 (以下简称“智新科技 ”) 正式授牌 这是东风公司贯彻新发展理念
独家原创|换防已近一年 徐平/竺延风动刀一汽/东风,搜狐网,2016年3月4日,"去年国内大型央企集团一汽、东风相继被曝出腐败窝案后,国家层面做出的应对措施是竺延风和徐平紧急换防(即东风汽车董事长徐平出任一汽董事长,前一汽董事长竺延风则出任东风董事长)。 自2015年5月6日,竺延风被任命为东风公司董事长、党委书..."
真是忙碌啊!竺延风履新东风35天工作记录~,搜狐网,2015年6月11日,"这是汽车维基第280篇稿件,原创稿。距离5月6日徐平和竺延风在东风大道特1号东风汽车公司总部大楼门口进行工作互换,到现在不过35天,两位又在武汉会面了,这次是徐平率一汽团访问东风,竺延风率队与之进行会谈,并陪同客人参观东风。由于一汽和..."
原创东风董事长徐平调任一汽 竺延风接管东风,环球网汽车频道,2015年5月7日,"【太平洋汽车网 行业频道】两家汽车业内央企将迎来新掌门:现吉林省委副书记竺延风将出任东风汽车董事长,而东风汽车公司(下称东风)董事长徐平将调任一汽集团董事长。多位信源向财新网确认了这一消息,并称正式任命将很快对外公布。"
"竺延风调研东风轻型车,强调跑出加速度",易车网,2020年4月2日,"4月1日,公司董事长、党委书记竺延风到东风汽车股份有限公司商品研发院调研,了解东风轻型车事业研发、生产情况,听取东风汽车股份2020年经营及党建工作汇报。 竺延风指出,在当前发展形势下,东风汽车股份要抢抓政策机遇,咬紧目标不放松,千方百..."
竺延风接棒东风徐平转战一汽 掌舵手换位,中国汽车报社有限公司,2015年5月11日,"1999年,竺延风刚一出任总经理,便开始对一汽内部大刀阔斧地重组,把那些产能低下的生产厂卖掉或者关掉,放弃了一汽过去纵向整合的策略,清理效率低下的零配件厂。而在东风已工作33年的徐平,则拥有丰富的工作阅历,自2010年成为东风汽车公司..."
且看竺延风如何“驭”东风,中国汽车报社有限公司,2015年5月6日,"现年54岁的竺延风,可谓中国汽车界一道难忘的风景。他1983年加入一汽, 1999年担任一汽集团公司总经理及党委书记,与时任东风汽车公司总经理苗圩、上汽集团总经理胡茂元并称为中国汽车业界“三少帅”。2007年,竺延风进入政界,先后担任吉林省..."
竺延风:做汽车必须实实在在,搜狐网,2017年4月23日,"“东风汽车的发展不是坐电梯而是爬楼梯,做汽车必须实实在在。”竺延风说。这也是央企东风的造车态度。 对外联合,对内协同 在竺延风提出的“持续提升创新驱动能力,是东风公司突破发展的主攻方向”目标之下,东风汽车对内“协同战略”,对外..."
竺延风任东风汽车公司董事长 徐平不再担任,映象网,2015年5月6日,"中国经济网北京5月6日讯 据国资委官方微博“国资小新”消息,5月6日上午,东风汽车公司召开中层以上管理人员大会。中共中央组织部干部五局局长毛定之宣布了党中央、国务院关于东风汽车公司主要领导变动的决定:竺延风同志任东风汽车公司董事长、..."
"90后看老总:东风汽车公司竺延风,戴着镣铐的舞者",牛车网,2017年10月30日,"竺延风只因有着东风汽车公司董事长的标签,他所做的事情就变得耐人寻味和具有代表性,而戴着镣铐在东风公司舞蹈就是他的工作日常。 不过,他同样是大环境里“他们”的一员。 他们不重业绩,又很重业绩 ..."
吉林省委副书记竺延风任东风汽车公司董事长(图/简历),凤凰网,2015年5月6日,"据国资委官微,5月6日上午,东风汽车公司召开中层以上管理人员大会。中共中央组织部干部五局局长毛定之宣布决定:竺延风同志任东风汽车公司董事长、党委书记;免去徐平同志东风汽车公司董事长、党委书记职务,另有任用。"
吉林省委副书记竺延风任东风汽车公司董事长 徐平另有任用,中国经济网,2015年5月6日,"中国经济网长春5月6日综合报道(尹彦宏)2015年5月6日,东风汽车公司召开中层以上管理人员大会。中共中央组织部干部五局局长毛定之宣布了党中央、国务院关于东风汽车公司主要领导变动的决定:竺延风同志任东风汽车公司董事长兼党委书记;免去徐平同..."
任学锋陈建华会见东风汽车公司竺延风朱福寿一行,搜狐网,2015年6月3日,"(记者毕征 通讯员史伟宗)昨日,广州市委书记任学锋,市委副书记、市长陈建华在广州会见东风汽车公司董事长竺延风、总经理朱福寿一行。 任学锋、陈建华对竺延风、朱福寿一行表示欢迎。任学锋说,汽车产业是广州重要支柱产业,包括东风日产在内的..."
东风汽车公司领导调整:竺延风任董事长 徐平另有任用,闽南网,2015年5月6日,"[摘要]竺延风任东风汽车公司董事长、党委书记;徐平另有任用。 今日,东风汽车公司召开中层以上管理人员大会。中组部干部五局局长毛定之宣布了党中央、国务院关于东风汽车公司主要领导变动的决定:竺延风同志任东风汽车公司董事长、党委书记;免去..."
"五一期间,竺延风专程去了这里……",搜狐网,2020年5月6日,"5月3日至4日,东风汽车集团有限公司(以下简称东风公司)董事长、党委书记竺延风先后到东风公司十堰基地、襄阳基地,走访东风商用车有限公司车身厂、东风锻造有限公司铸造一厂、东风汽车股份轻型商用车分公司,了解近期基层单位生产经营情况,慰问“..."
竺延风:“少帅”迟暮?,搜狐网,2019年11月13日,"2016年,竺延风东风汽车时代的开始,彼时时值东风汽车冒进的虚胖期,各板块已经存在着各种各样的问题,竺延风那个时候还是信心满满,颇有点火之势,企图打破东风汽车当时的格局。他曾经公开对媒体表示,“独立还是整合,要去看市场驱动的因素。如果..."
3天!竺延风调研3大基地18家单位,搜狐网,2015年5月19日,"5月13日、14日,东风公司董事长、党委书记竺延风深入公司十堰基地基层单位生产现场和班组园地,详细了解各单位的生产经营、班组建设和企业文化建设情况,与一线员工亲切交流,试乘试驾东风自主品牌商用车、乘用车、军车,并看望了公司离退休老同志..."
竺延风的用人观,汽车头条,2020年4月11日,2015年对于竺延风而言大抵可以称为一个人生的转折点，这一年竺延风接过了接力棒，成为东风汽车董事长、党委书记。在其上任的这些年，东风汽车内部领导班子也进行了多次调整。自主板块方面，2017年刘洪接替李春荣出任东风乘用车公司总经理一职...
竺延风任东风汽车公司,中国政府网,2015年5月7日,"中国共产党新闻网北京5月7日电(崔小粟)据东风汽车公司网站消息,2015年5月6日上午,东风汽车公司召开中层以上管理人员大会。中共中央组织部干部五局局长毛定之宣布了党中央、国务院关于东风汽车公司主要领导变动的决定:竺延风同志任东风汽车公..."
中央第七巡视组巡视东风汽车集团有限公司党委工作动员会召开,中央纪委国家监委网站,2019年4月2日,"根据中央关于巡视工作的统一部署,2019年3月28日上午,中央第七巡视组巡视东风汽车集团有限公司(以下简称东风公司)党委工作动员会召开。会前,中央第七巡视组组长郭旭明主持召开与东风公司党委书记、董事长竺延风,党委副书记、总经理李绍烛的见面..."
东风商用车有限公司领导班子调整,中国商用汽车网,2016年6月20日,"2016年6月20日,东风商用车有限公司在注册地十堰召开干部大会。东风汽车公司董事长、党委书记竺延风出席会议并作重要讲话,东风汽车公司党委常委、副总经理童东城主持会议。东风汽车公司人事(干部)部长何伟宣读东风商用车有限公司主要领导调整文件..."
黄伟任东风汽车集团有限公司董事、党委副书记,腾讯网,4月26日,"东风汽车微信公众号消息,2021年4月26日,东风公司召开领导班子(扩大)会。受中组部委托,东风公司董事长、党委书记竺延风同志宣布了中组部关于干部任职的决定:黄伟任东风汽车集团有限公司董事、党委副书……"
对话|东风“十四五”定下3个“百万”目标 乔阳:正在酝酿电动越野...,腾讯网,10天前,"东风汽车集团有限公司董事长、党委书记竺延风表示。 今年以来,智能汽车赛道的玩家越来越多,除了特斯拉、蔚来、理想等新势力,百度、小米等科技公司也纷纷宣布下场造车,同时众多传统车企也在加速向科技型企业转型。 “互联网公司进入汽车行业,..."
外媒视点|对话竺延风 东风自主事业大有希望,腾讯网,3月30日,"走进东风汽车集团有限公司(以下简称“东风公司”),刚参加两会回来的东风公司董事长、党委书记竺延风接受了我们的专访。在此,我将分享走进东风几天来眼见为实的切身感受。归结为一句话:东风自主事业大有希望。"
两会|全国政协委员竺延风:建议积极创造智能网联汽车商业化落地条件,中国经营报,3月12日,“应在不同的示范区认证成果中博采众长，加快统一认证标准和技术要求，推动认证互通和数据共享，提升自动驾驶汽车整体技术水平。”竺延风建议。据了解，除竺延风担任全国政协委员外，东风公司体系内还有谈民强、王建清和杨祉刚等三位全国人大...
竺延风点赞东风本田:你们辛苦了!你们真的是了不起!,搜狐网,1月5日,"1月5日,东风本田2021年上班第一天,公司董事长、党委书记竺延风来到东风本田热火朝天的生产现场调研并指导工作。他向东风本田全体员工致以新年问候,对东风本田2020年高质量达成85万辆目标给予充分肯定,“你们为集团生产经营疫后恢复正常,为集..."
"半年两次升任,杨青接棒李绍烛任东风公司总经理",网易订阅,2月26日,"经过此次的人事调整之后,杨青正式成为东风公司二把手,和董事长、党委书记竺延风组成新的领导班子。 公开资料显示,杨青自1988年进入东风公司以来,均在东风系工作,是“土生土长”的东风人。曾先后担任东风汽车股份总经理、东风商用车有限公司..."
竺延风:东风将打造岚图为高端新能源乘用车领先者 已规划九款产品...,搜狐网,2020年7月29日,"2020 年 7 月 29 日,东风汽车集团有限公司(以下简称东风公司)在武汉发布岚图汽车品牌战略,旗下首款概念车 VOYAHi-Land(参数|图片) 全球首发。 发布会上,东风汽车集团有限公司董事长、党委书记竺延风为新品牌站台。他介绍,岚图制定了..."
东风公司调整核心团队 迎接十四五开局,国际在线,2月26日,"竺延风对东风公司总部干部员工也提出要求。他表示,2021年,公司总部机关员工要持续加强学习,提高知识本领,学出市场机遇;要通过学习转变观念,善于“站在‘庐山’外面看汽车”,及时洞察汽车行业发展趋势;要持续发扬刻苦奋斗精神,在紧张、快节奏..."
岚图:竺延风最后的战场or秀场?,愉观车市,2020年9月2日,“自主品牌要耐得住寂寞20年！”17年前，时任一汽集团掌门人的竺延风此言一出，引起汽车行业轩然大波。弹指一挥间即将20年，汽车行业印证了竺延风当初的这句话，而竺延风也老了。20年匆匆而过，岁月不饶人，1961年3月出生的东风公司...
中国汽车蓝皮书论坛在汉开幕 竺延风:冬天熬过去还有春天,千龙网·中国首都网,2020年8月12日,"8月11日,第12届中国汽车蓝皮书论坛(CABF)在武汉开幕,论坛以“冬芽”为主题,在传递着积极、向上、乐观和一往无前的精神的同时,也与积聚力量、重塑格局中的中国汽车工业形成同频共振。 东风公司董事长的竺延风 ..."
东风跨过那扇门 | 汽车产经,易车网,2020年8月3日,"舞台上无数扇紧闭的大门,东风汽车集团有限公司董事长、党委书记竺延风跨过最中间的一扇,出现在舞台的中央。 这是7月29日,东风旗下的全新高端新能源品牌岚图战略发布会上的一幕。 2019年,东风曾迎来自己成立的第50个年头。2020年是东风..."
杨青出任董事、党委副书记!东风汽车集团公司领导成员调整,搜狐网,2020年7月31日,"2020年7月30日上午,东风汽车集团有限公司召开领导班子(扩大)会,东风汽车集团有限公司董事长、党委书记竺延风同志宣布了中央关于干部任免的决定:杨青同志任东风汽车集团有限公司董事、党委副书记,不再担任东风汽车集团有限公司副总经理职务;程道..."
"东风汽车的全新高端品牌“岚图”,到底是“蓝图”还是“烂途”?",搜狐网,2020年7月20日,"根据东风集团的规划,新能源汽车目标是“2023年销量达成80万辆,市占率18%,整车性能水平达国际一流水平,完全自主掌控新能源核心总成”。岚图能否成功,这不仅关乎东风作为“二皇子”的颜面,也关乎竺延风南下掌舵东风公司,整整5年的执政能力..."
竺延风:将东风汽车打造成享誉海内外的中国品牌,中国产业经济信息网,2017年5月26日,"东风公司董事长、党委书记竺延风就此表示,东风汽车公司将始终坚持以市场为导向、以客户为中心,更加重视品质提升和品牌塑造,将更多更好的产品和优质服务带给消费者,将“东风汽车”打造成为享誉海内外的中国品牌。 1997年,国家工商局向东风..."
"切割腐肉,挑破脓包,刮骨疗毒,竺延风的断舍离",易车网,2020年6月19日,"面对市场、疫情的各种不确定性,竺延风领导的东风汽车集团有限公司(东风公司)现在痛下杀手,在公司内部扫除各种枝枝蔓蔓,找到未来发展的确定性。 首先东风雷诺汽车有限公司在4月结束半死不活的状态,法国雷诺在合资公司那50%股份转让给东风..."
竺延风解读疫情防控和经营发展的“东风答卷”,腾讯网,2020年5月24日,"5月22日,新华网主持人梁懿以视频连线的方式,与全国政协委员、东风汽车集团有限公司董事长、党委书记竺延风进行了对话。竺延风就疫情防控阻击战与经营发展总体战中的“东风答卷”、打赢扶贫攻坚战中的“东风行动”,以及“十三五”时期的东风..."
东风全新高端品牌h蓄力 董事长、党委书记竺延风致信,易车网,2020年5月6日,"易车讯 今日,东风汽车集团有限公司董事长、党委书记竺延风致信东风h事业部。东风h事业部成立于2019年4月,是东风公司探索高端汽车品牌的重要实践,其专注于高端新能源乘用车领域,是东风未来10年最重要的战略布局。h事业部担负着“让汽车..."
"竺延风调研东风广州基地,点赞了这三家单位",搜狐网,2019年12月24日,"竺延风说,东风日产、东风启辰、东风南方出色完成2019年生产经营工作,在东风公司起到了良好的标杆作用。东风日产无须扬鞭自奋蹄,不断自我加压,自我革命,一直是东风公司的排头兵。在汽车行业形势急剧变化时,东风日产要勇于同自己的传统观念、..."
安铁成调任中汽研 竺延风、李绍烛进入倒计时,搜狐网,2019年9月16日,"中国车市下行之年,大部分合资与自主均有不同程度上的跌幅。但如神龙公司般三年内销量腰斩超半的主流车企,极为罕见。神龙公司走向谷底,其母公司东风集团,也正处在未知的变数中。 由政转商的这近5年时间里,竺延风过得异常低调。作为..."
东风公司董事长、党委书记竺延风赴兴山开展扶贫调研,搜狐网,2018年10月17日,"10月16日,公司董事长、党委书记竺延风到湖北宜昌兴山县调研东风公司“润楚工程”扶贫项目进展情况。竺延风与兴山县领导班子成员、相关负责人前往各扶贫点考察,听取相关扶贫产业和脱贫情况介绍,交流研讨下一步脱贫攻坚举措。"
竺延风入选“改革开放40年·致敬中国汽车人物”,新华网客户端,2018年7月2日,"6月30日,中央电视台财经频道推出的“改革开放40年·致敬中国汽车人物”盛典在京举行。东风汽车集团有限公司董事长、党委书记竺延风获选。 本次“改革开放40年·致敬中国汽车人物”活动,邀请汽车产、学、研,以及相关媒体精英组成权威的“推..."
中国共产党东风汽车集团有限公司新一届党委常委、纪委常委选举产生,搜狐网,2018年6月28日,"6月28日下午,中国共产党东风汽车集团有限公司第九届委员会举行第一次全体会议。会议选举尤峥、乔阳、安铁成、李绍烛、杨青、张祖同、竺延风、程道然、温树忠(按姓氏笔画为序)为中国共产党东风汽车集团有限公司第九届常务委员会委员,选举竺..."
为全面建成小康社会贡献东风力量,国务院国有资产监督管理委员会,2017年12月15日,"竺延风表示,东风公司这几年一直把精准扶贫工作摆在突出位置,制定社会责任“润”计划,规范化、科学化、制度化推进精准扶贫;同时不断挖掘自身特色优势,以汽车为载体,通过汽车捐赠、发展汽车配套产业等方式,打造精准扶贫的“东风模式”。"
吉林副书记竺延风接掌东汽 东风否认与一汽合并,中国青年网,2015年5月7日,"5月6日,东风汽车公告公司主要领导变动,竺延风任东风汽车公司董事长、党委书记;免去徐平东风汽车公司董事长、党委书记职务,另有任用。据新京报记者了解,徐平在参加完当日的中层以上管理人员大会后就已离开武汉前往长春。"
"市值观察丨东风闪电回A百亿押注新能源,一次革命两面作战?",新浪财经,2020年12月25日,2015年，朱福寿从东风汽车总经理岗位黯然离职，东风“大自主”战略基本宣告失败。而在竺延风时代，东风自主品牌依旧没有改变低端市场扎推、品牌张力不足等问题，“四大风”品牌依旧处于无序、零散的经营状况。截至目前，东风集团成员企业主要...
"资讯|东风集团上会在即,将刷新创业板募资纪录",新浪财经,2020年12月8日,“此次寻求深交所创业板上市，是对东风创新体制的检验和实践。”在东风集团董事长、党委书记竺延风看来，近年来，东风集团积极布局新能源汽车、智慧汽车领域，已经取得了一定成果。“为了更快、更好的落实公司转型发展战略，加大新兴方向的...
"东风集团与国家电网战略合作,推出车电分离商业模式",新浪财经,2020年11月27日,国家电网有限公司副总经理、党组成员庞骁刚在活动中指出，“下一步，双方将充分发挥各自专业优势，通过两家央企合作，以深入合作形成示范引领，推动产业链资源有机整合。”东风集团董事长、党委书记竺延风竺延风也表示， “这次战略合作，双方...
东风集团与国家电网签署系列战略合作协议,金融界,2020年11月26日,“结合了各自优势，双方就新能源汽车与能源互联网的战略合作，对共同推动国家新能源汽车与能源互联网产业发展战略落地，具有十分重要的意义。”东风集团董事长、党委书记竺延风表示。作为全球最大的电力巨擘，国家电网有限公司为东风集团提供了...
"刷新两项新纪录!东风集团受理4天就获问询,募资210亿元成创业板最...",红星新闻,2020年10月18日,东风集团董事长竺延风在发布会现场表示，对于未来，岚图制定了未来3-5年的发展规划，实现覆盖轿车、SUV、MPV以及跨界车、高性能车等各个细分市场。从2021年起，每年将向市场投放不少于一款新车型。东风集团在招股书中表示，公司计划在2021...
东风集团A股IPO申请获受理 拟募资210亿元,证券时报e公司,2020年10月13日,疫情结束后，东风集团经营情况逐渐好转。东风集团股份披露的8月产销快报显示，今年前8个月汽车销量163.89万辆，同比下跌10.37%，下滑幅度进一步收窄。在半年报中，董事长竺延风对下半年目标做了展望，其中就包括“持续打造高端新能源“岚...
岚图——托举着整个东风品牌向上的重任,科技争锋,2020年8月17日,"东风汽车集团有限公司董事长竺延风(来源:岚图)这座城市重启后的第112天(7月29日),东风公司发布岚图汽车品牌战略,首款概念车VOYAH i-Land全球首发。发布会现场,腾讯副总裁钟翔平、华为公司智能汽车解决方案BU总裁王军、宁德时代董事长..."
"通报:一批供应商被拉入黑名单,东风本田两员工被提起公诉",网易,2020年8月16日,"据了解,在今年7月初召开的东风越野车有限公司干部大会上,东风汽车集团有限公司董事长竺延风强调,“腐败是毒瘤,只有割除腐败这个最恶性的毒瘤,事业才能健康发展。”他还称,必须按照相关规定行权履职,任何时候都不能为个人谋取私利。"
东风“打虎”60天:大会、辟谣与上央视,汽车头条,2020年8月14日,对于东风而言，作为大型国有企业，是中国汽车产业发展中的不可或缺的一份子，铲除“腐败”毒瘤以助中国汽车产业健康发展更是其必须承担的职责。五年前，竺延风刚刚接手东风汽车时，就亲历了一场深层次的反腐行动。而五年之后，东风再度对...
"“冬芽”在英雄之城武汉绽放,蓝皮书论坛首日概览",网易订阅,2020年8月12日,"11日,湖北省武汉市委副书记、市长周先旺到会致辞,福耀玻璃创始人、董事长曹德旺,东风汽车集团董事长、党委书记竺延风,北汽集团原董事长、轩辕大学导师徐和谊,长城汽车董事长魏建军,蔚来汽车创始人、董事长兼CEO李 ,小鹏汽车董事长兼CEO何小鹏..."
