title,source,time,summary
"中兴通讯董事长李自学:5G联结视界,创新开启未来",数字电视中文网,2020年11月4日,"中兴通讯以“超视界,新未来”为主题参展,展示了中兴通讯在5G+大视频、5G+智慧场馆、5G+Cloud VR、2D转3D、5G+超清视讯、5G+行业应用等方面的创新方案及应用成果。中兴通讯董事长李自学受邀在主论坛发表《5G联结视界,创新开启未来》..."
中兴通讯股份有限公司第八届董事会第三十二次会议决议公告,搜狐网,2月19日,"中兴通讯股份有限公司(以下简称“中兴通讯”或“公司”或“本公司”)已于2021年2月5日以电子邮件的方式向公司全体董事发出了《关于召开中兴通讯股份有限公司第八届董事会第三十二次会议的通知》。2021年2月10日,公司第八届董事会第三..."
鲍毓明退出中兴通讯股份有限公司董事行列 曾遭司法部点名:取得...,每日经济新闻,2020年7月20日,每经编辑：胡玲 据启信宝数据显示，7月17日，中兴通讯股份有限公司发生工商变更，Yuming Bao（鲍毓明）退出公司董事，新增董事为庄坚胜。工商信息显示，中兴通讯股份有限公司成立于1997年11月，注册资本41.9亿人民币，法定代表人为李自学...
BlackRock Inc.减持中兴通讯股份约192.74万股,腾讯网,2020年9月24日,"中兴通讯股份有限公司的董事长是李自学,男,56岁,于1987年毕业于西安交通大学电子元件与材料专业,获工学学士学位,具备研究员职称。 中兴通讯股份有限公司的总裁是徐子阳,男,48岁,于1994年毕业于电子科技大学物理电子技术专业,获得工学学士..."
中兴通讯董事长 李自学,人民邮电报,2020年10月14日,"中兴通讯定位为数字经济的筑路者,以联接和计算两大能力为核心,为行业赋能。即致力于提供极致性能、全场景接入的精品网络,让数据连接无处不在;提供精准云网方案,让计算和智能触手可及,为千行百业提供贴身化服务;搭建赋能平台,广聚行业..."
戴厚良会见中兴通讯董事长李自学,中国石油新闻中心,2020年11月11日,"中国石油网消息(记者李妍楠)11月10日,中国石油集团党组书记、董事长戴厚良在北京会见了中兴通讯党委书记、董事长李自学,双方围绕5G应用、物联网建设等方面深入交换了意见。 戴厚良对李自学一行的到访表示欢迎。他说,今年以来,面对新冠..."
鲍毓明退出中兴通讯股份有限公司董事行列,站长之家,2020年7月20日,"DoNews 7月20日消息(记者 刘文轩)天眼查数据显示,近日,中兴通讯股份有限公司发生工商变更,Yuming Bao(鲍毓明)退出公司董事,新增董事为庄坚胜。中兴通讯股份有限公司成立于1997年11月,注册资本41.9亿人民币,法定代表人为李自学,公司经营..."
鲍毓明退出中兴通讯股份有限公司董事行列 新增董事庄坚胜,腾讯网,2020年7月20日,"中兴通讯股份有限公司是国内仅次于华为的第二大通讯企业,成立于1997年,注册资本为41.9亿人民币,法定代表人为李自学。 对于此次工商的变更,有报道指出是因鲍毓明个人问题,而给公司企业带来巨大不利的负面影响,故而辞退做变更处理,维护公司..."
BlackRock Inc.增持中兴通讯股份约179.94万股,每日经济新闻,2020年8月21日,中兴通讯股份有限公司的董事长是李自学，男，56岁，于1987年毕业于西安交通大学电子元件与材料专业，获工学学士学位，具备研究员职称。 中兴通讯股份有限公司的总裁是徐子阳，男，48岁，于1994年毕业于电子科技大学物理电子技术专业，获得工...
陕西省与中兴通讯股份有限公司举行会谈 胡和平刘国中李自学出席,中国共产党新闻网,2019年9月4日,"本报讯 9月3日,我省与中兴通讯股份有限公司在西安举行会谈。 省委书记胡和平主持并讲话。省长刘国中介绍陕西经济高质量发展、工业产业布局、营商环境等情况。中兴通讯股份有限公司董事长李自学介绍企业发展情况。"
中兴高管大换血 新董事长李自学何以“中兴”? |深读,新京报,2018年6月30日,西安微电子技术研究所是中兴通讯控股股东中兴新的股东之一，公告称李自学不持有公司股份，并且与董事、监事、管理高级人员不存在关联。事实上，1997年10月，中兴通讯申请IPO时发布的招股书显示，筹委会主任张太峰时任是西安微电子技术研究所...
中兴通讯:选举李自学先生为公司第七届董事会董事长,金融界,2018年6月29日,今日晚间消息，中兴通讯公告称，选举李自学先生为公司第七届董事会董事长。殷一民、张建恒等原十四名董事一致同意立即辞去本公司董事职务以及所担任的董事会下设各专业委员会的职务。当日公司举行的年度股东大会上，《公司2017年度利润分配预案...
中兴通讯董事长李自学:5G技术大规模的应用可以带来各行各业的变革,36氪,2019年11月22日,"中兴通讯股份有限公司董事长、执行董事李自学今天在京出席“2019年创新经济论坛”时表示,“以5G为代表的信息技术时代已经到来”,5G技术大规模的应用,可以带来各行各业的变革,5G设备供应链也会带来巨大的变化,“5G的应用现在还不是很清楚..."
刘中伯在深圳与中兴通讯董事长李自学座谈,搜狐网,2019年4月17日,"4月16日,市委书记刘中伯率队赴广东省深圳市开展投资促进活动,与中兴通讯股份有限公司董事长李自学座谈,就进一步加强双方合作展开深入交流。中兴通讯股份有限公司5G首席合作官苏晞出席。 刘中伯说,当前,宜宾正大力实施“产业发展双轮驱动”..."
公告精选:中兴通讯选举李自学为董事长;上海家化新基地部分投产运营,证券时报e公司,2018年6月29日,中兴通讯(000063)6月29日晚公告，选举李自学为公司第七届董事会董事长。另外，当日公司举行的年度股东大会上，《公司2017年度利润分配预案》遭否决。坚瑞沃能：沃特玛放假的内部文件属实 仅限于深圳地区员工 坚瑞沃能(300116)6月29日晚...
中兴通讯李自学 聚焦5G建网 确保行业领先!,搜狐网,2018年12月28日,"12月28日简讯,中兴事件后,换帅上阵,收拾烂摊子的李自学,正带领中兴通讯来一次凤凰涅槃重生发展。李自学称,公司制定了""恢复、发展、超越""的三阶段战略实施路径。2019年将更加聚焦主航道,坚定不移地执行好既定战略。在市场方面,坚持全球化..."
李自学为中兴通讯新任董事长 原14名董事立即辞去职务,金融界,2018年6月29日,通过天眼查，记者注意到，新任董事长和董事会非独立董事均与中兴通讯大股东中兴新存在千丝万缕的联系。其中，李自学在中兴新的股东西安微电子技术研究所任党委书记兼副所长；李步青在中兴新的股东深圳航天广宇工业有限公司任董事；顾军营为...
中兴通讯发布公告:李自学成为新任董事长,通信世界网,2018年6月29日,"通信世界网消息(CWW)中兴通讯今日发布公告宣布,选举李自学先生为公司第七届董事会董事长。董事会原十四名董事一致同意立即辞去本公司董事职务以及所担任的董事会下设各专业委员会的职务。 本次会议以记名投票的方式审议并通过了除议案 6..."
中兴通讯(00763)选举李自学为董事长,深圳智通财经,2018年6月29日,"​智通财经APP讯,中兴通讯(00763)发布公告,2018年6月29日,该公司董事会会议审议通过《关于选举第七届董事会董事长的议案》,选举李自学为公司第七届董事会董事长;及审议通过《关于选举第七届董事会非执行董事、执行董事的议案》,选举..."
张庆伟会见中兴通讯股份有限公司董事长李自学,东北网,2019年8月1日,"东北网8月1日讯 (黑龙江日报记者 孙佳薇)1日晚,省委书记、省人大常委会主任张庆伟在哈尔滨会见中兴通讯股份有限公司董事长李自学一行。 张庆伟代表省委省政府对李自学一行的到来表示欢迎,对中兴通讯为推进“数字龙江”建设提供的支持表示感..."
中兴通讯股份有限公司2019第一季度报告,东方财富网,2019年4月30日,"1.1中兴通讯股份有限公司(以下简称“中兴通讯”、“本公司”或“公司”)董事会、监事会及董事、监事、高级管理人员保证本报告内容的真实、准确、完整,不存在虚假记载、误导性陈述或重大遗漏,并承担个别和连带的法律责任。"
中兴通讯股份有限公司公告(系列),搜狐网,2018年7月28日,"本次会议由董事长李自学先生主持,应到董事8名,实到董事8名,公司监事会成员及相关人员列席了本次会议。本次会议的召开符合有关法律、行政法规、部门规章以及《中兴通讯股份有限公司章程》的有关规定,会议合法、有效。"
中兴通讯股份有限公司被列为被执行人,智东西,2019年12月18日,"中兴通讯股份有限公司是中兴通讯的运营主体,为A股上市公司,公司成立于1997年11月,注册资本约42亿人民币,公司法定代表人为董事长李自学,公司经营范围包括生产程控交换系统、多媒体通讯系统、通讯传输系统;研制、生产移动通信系统设备、卫星通讯..."
中兴换帅!传李自学将出任中兴通讯新董事长,网易订阅,2018年6月27日,"6月26日,有媒体报道称,西安微电子党委书记兼副所长李自学,将出任中兴通讯新董事长。 中兴官方对此不予置评。 6月12日,中兴通讯曾在A股、港股同时发布公告,称公司已与BIS达成《替代的和解协议》。根据协议,所有罚款全部到账后,BIS才..."
中兴通讯换帅 李自学出任新董事长,搜狐网,2018年6月29日,"6月29日中兴通讯连续发布11条公告,选举李自学为公司第七届董事会董事长,选举李步青 、诸为民 、方榕为公司第七届董事会非执行董事。与此同时,殷一民、张建恒、栾聚宝 、赵先明 、王亚文 、田东方 、詹毅超 、韦在胜 、翟卫东 、张曦轲..."
孟凡利会见中兴通讯董事长李自学一行,人民网,2019年8月19日,"今天(18日)下午,(青岛)市委副书记、市长孟凡利在市级机关办公楼会见了中兴通讯股份有限公司董事长李自学一行,双方就进一步深化务实合作,实现共赢发展进行了深入交流。 孟凡利说,中兴通讯是全球领先的综合通信解决方案提供商,在5G发展方面处于..."
中兴通讯董事长:自主研发操作系统将成核心竞争力,搜狐网,2019年9月11日,"中兴通讯股份有限公司董事长李自学在大会上发表主旨演讲时表示,网络信息技术创新是应对越来越严峻的国际挑战的必由之路。 李自学说,世界上第一台计算机诞生于1946年,距今不过70多年,但计算机技术的不断创新迭代,推动世界飞速发展,网络信息..."
中兴通讯股份有限公司2018年度报告摘要,搜狐网,2019年3月28日,"1.3本公司第七届董事会第四十六次会议已审议通过年度报告。董事顾军营先生因工作原因未能出席本次会议,委托董事长李自学先生行使表决权。 1.4中兴通讯及其附属公司(“本集团”)按照中国企业会计准则编制的截至2018年12月31日止的年度财务..."
20190904我省与中兴通讯股份有限公司举行会谈 胡和平刘国中李自学...,陕西省人民政府门户网站,2019年9月4日,"20190904我省与中兴通讯股份有限公司举行会谈 胡和平刘国中李自学出席 播放器加载失败: 未检测到Flash Player,请到安装"
中兴通讯董事长李自学做客央视 畅谈5G的强应用,TechWeb,4月25日,李自学表示，5G的应用场景十分广阔，5G可以赋能千行百业，比如技术冶炼，智能制造等。将来包括运维检测的远程化，危重场地的无人化等也都会大量的引入5G的应用。李自学指出，5G应用在工业场景能带来三个好处：省钱，省人，省心。中兴通讯...
数字化转型进行时 博鳌亚洲论坛:从5G、工业互联网和人工智能技术...,天目新闻,4月22日,"中兴通讯董事长李自学表示,除了技术冶炼、智能制造,将来的运维检测远程化、微重场地无人化等,都会大量引用5G的场景。 “5G应用在工业场景里,带来的好处有三个:省钱、省人、省心。”李自学说。 《5G的未来》主题分论坛 5G既然有赋能..."
后疫情时代向上增长的力量 董明珠向李佳琦“取经”,和讯网,4月22日,"中兴通讯(000063,股吧)董事长李自学,上海振华重工(600320,股吧)(集团)股份有限公司董事长兼总裁刘成云,天鹅到家创始人兼CEO陈小华,小罐茶创始人、董事长杜国楹,瑞士再保险中国总裁陈东辉,火链科技CEO袁煜明,科大讯飞(002230,股吧)股份有限..."
上天入地、省钱省人省心……电信大咖博鳌聊5G热点,腾讯网,4月19日,"中兴通讯股份有限公司董事长李自学表示,如果从用信息高速公路来说,时速大概估计应该在60到80公里。 李自学说,5G的应用场景很广阔,5G可以赋能千行百业。把5G应用在工业场景里,带来的好处有三个: 省钱、省人、省心。"
博鳌论坛嘉宾名单公布!周小川、易纲、库克、马斯克等将出席,腾讯网,4月17日,49. 珠海格力电器股份有限公司董事长兼总裁 董明珠 50. 中兴通讯董事长 李自学 51. 中国平安人寿保险股份有限公司党委书记 杨铮 52. 国家开发投资集团有限公司董事长 白涛 53. 中国核工业集团有限公司总经理、党组副书记 顾军 54. 中国...
博鳌亚洲论坛年会企业嘉宾公布!库克马斯克都要来,和讯网,4月16日,"47. 珠海格力电器股份有限公司董事长兼总裁 董明珠 48.中兴通讯(000063,股吧)董事长 李自学 49.新希望集团董事长 刘永好 50.中国平安(601318)人寿保险股份有限公司党委书记 杨铮 51. 国家开发投资集团有限公司董事长 白涛 ..."
这些嘉宾将出席今年的博鳌亚洲论坛年会,腾讯网,4月13日,45. 珠海格力电器股份有限公司董事长兼总裁董明珠 46. 中兴通讯董事长李自学 47. 新希望集团董事长刘永好 48. 中国平安人寿保险股份有限公司党委书记杨铮 49. 国家开发投资集团有限公司董事长白涛 ...
中兴通讯2020年营收重回千亿元 将持续发力重塑品牌,新浪财经,3月18日,“2021年，公司终端市场将在海外保持稳健经营，国内全面发力ToC市场，赋能终端渠道，实现终端品牌重塑。”中兴通讯董事长李自学在董事会报告中表示。2020年9月份，中兴旗下努比亚联合创始人、总裁倪飞重归执掌中兴终端事业部后，中兴发布全球首...
中兴通讯:2020年年度报告摘要,同花顺财经,3月17日,"1.1 中兴通讯股份有限公司(“中兴通讯”或“本公司”或“公司”)董事会、监事会及董事、监事、高级管理人员保证二〇二〇年年度报告(“年度报告”)内容的真实、准确、完整,不存在虚假记载、误导性陈述或重大遗漏,并承担个别和连带的法律..."
中兴通讯董事长、执行董事李自学:锻造通信产业长板 构建新发展格局,东方财富网,3月5日,"通信设备产业是中国制造步入世界领先行列的三大产业之一,为进一步加强通信产业长板,推动数字经济高质量发展,建议采取有效措施,打好自主芯片制造攻坚战,补齐产业链条,强化国家战略科技根基;持续推进5G新基建,为各行业数字化和智能化转型升级..."
中兴通讯:以10.35亿元转让北京中兴高达通信技术有限公司90%股权,东方财富网,1月11日,"中兴通讯(SZ 000063,收盘价:34.93元)1月11日晚间发布公告称,基于中兴通讯股份有限公司的战略发展考虑,公司与北京屹唐半导体产业投资中心(有限合伙)于2021年1月11日签订《股权转让协议》。根据《股权转让协议》,公司以10.35亿元人民币向..."
中兴通讯:拟26.11亿元收购中兴微电子18.82%股权,站长之家,2020年11月16日,"中兴通讯公告,拟以发行股份方式购买恒健欣芯、汇通融信合计持有的公司控股子公司中兴微电子18.8219%股权,交易价格为26.1亿元。公司拟募集配套资金不超过26.1亿元,用于5G关键芯片研发项目和补充流动资金项目。"
【中国石油集团党组书记戴厚良会见中兴通讯董事长李自学】11月10...,市商网,2020年11月11日,"【中国石油集团党组书记戴厚良会见中兴通讯董事长李自学】11月10日,中国石油集团党组书记、董事长戴厚良在北京会见了中兴通讯党委书记、董事长李自学,双方围绕5G应用、物联网建设等方面深入交换了意见。李自学表示,当前正值国内5G“新基建”..."
中兴通讯董事长李自学:5G超高清会在行业领域发挥巨大价值,通信世界网,2020年11月4日,"通信世界网消息(CWW)近日,在2020超高清视频4K/8K产业大会上,中兴通讯董事长李自学受邀在主论坛发表了“5G联结视界,创新开启未来”主题演讲。李自学表示,5G是新基建的龙头和抓手,也是驱动整个社会数字化转型的核心动能,超高清的全面普及也..."
中兴通讯与广西壮族自治区政府签订5G战略合作框架协议,环球网,2020年8月27日,2020年8月25日，中兴通讯股份有限公司与广西壮族自治区政府在南宁签订5G战略合作框架协议，合作推动广西经济社会各领域5G应用。自治区主席陈武、中兴通讯董事长李自学共同见证协议签署。自治区党委、政府高度重视数字广西、数字经济建设，2019年...
奇瑞小蚂蚁打造自主核心知识产权L2+智能驾驶,网易汽车,2020年8月10日,"电子领域的合作;2019年7月,英博超算和奇瑞新能源双方签署合资协议,成立合资公司——安徽奇英智能科技有限公司,使得双方能够在更高更紧密的层面展开合作,从而更好的推动国产智能汽车发展,奇瑞汽车董事长尹同跃和中兴通讯董事长李自学共同出席..."
掌握核心关键技术 奇瑞新能源小蚂蚁智驾版智领未来,新能源汽车报价大全,2020年8月10日,2019年7月，英博超算和奇瑞新能源双方签署合资协议，成立合资公司——安徽奇英智能科技有限公司，使得双方能够在更高更紧密的层面展开合作，从而更好的推动国产智能汽车发展，奇瑞汽车董事长尹同跃和中兴通讯董事长李自学共同出席了揭牌仪式...
2020广东省制造业高质量发展论坛暨制造强省建设院士专家咨询会举行,南方新闻网,2020年8月7日,“我理解的高质量发展的内涵，就是更高品质、更有效率、更加可持续的发展。”中兴通讯有限公司董事长李自学在论坛上发表主旨演讲时表示，近年来，中兴通讯对5G海量连接等难题的突破，都是实现高质量发展的具体体现。要真正实现企业转型发展...
小米“梦之队”再添猛将!中兴通讯原副总裁曾学忠出任小米手机部总裁,站长之家,2020年7月29日,"据了解,曾学忠拥有20余年的通信行业从业经验,曾任中兴通讯执行副总裁、中兴手机CEO,和紫光集团全球执行副总裁、紫光股份总裁、紫光展锐CEO,是杰出的企业管理者和通信行业专家。在手机和上游核心器件领域均有卓越表现。 加入小米前,曾学忠担..."
中兴通讯原副总裁曾学忠加入小米 雷军出任集团战略委员会主席,站长之家,2020年7月29日,"DoNews 7月20日消息(记者 刘文轩)天眼查数据显示,近日,中兴通讯股份有限公司发生工商变更,Yuming Bao(鲍毓明)退出公司董事,新增董事为庄坚胜。中兴通讯股份有限公司成立于1997年11月,注册资本41.9亿人民币,法定代表人为李自学,公司经营范..."
"华为之后,中兴与茅台达成战略合作",中文业界资讯站,2020年7月22日,"茅台集团党委书记、董事长高卫东,中兴通讯股份有限公司董事长、执行董事李自学出席签约仪式并讲话,茅台集团党委副书记、总经理李静仁主持仪式。茅台集团总工程师王莉,中兴通讯股份有限公司高级副总裁朱永涛代表双方签署战略合作协议。中兴通讯股份..."
《中兴通讯:董事会提名李自学等人为非独立董事候选人》的相似新闻,云财经网,1月18日,e公司  公告精选:中兴通讯提名李自学等人为非独立董事候选人  01-17 20:12:00  证券时报  公告精选:中兴通讯提名李自学等人为非独立董事候选人  01-17 20:40:00  中金在线  公告精选:中兴通讯提名李自学等人为非独立董事候选人 ...
茅台集团与中兴通讯签署战略合作协议 推动“智慧茅台”建设,搜狐网,2020年7月21日,"中兴通讯股份有限公司董事长、执行董事李自学表示,中兴通讯致力于做产业提升和价值实现的赋能者,不仅要把5G的“高速路”建设好,更要和客户、运营商共同在这条路上实现更快更稳更安全的运行。茅台以工匠精神确保了始终如一的品质,是受人..."
鲍毓明严重违纪 退出中兴通讯董事行列,资本新文化,2020年7月20日,中兴通讯股份有限公司是国内仅次于华为的第二大通讯企业，成立于1997年，注册资本为41.9亿人民币，法定代表人为李自学。对于此次工商的变更，有报道指出是因鲍毓明个人问题，而给公司企业带来巨大不利的负面影响，故而辞退做变更处理，维护...
"鲍毓明退出中兴通讯董事,“性侵”风波后辞职,近日被司法部点名",搜狐网,2020年7月20日,"近日,天眼查数据显示,7月17日中兴通讯股份有限公司发生工商变更,Yuming Bao(鲍毓明)退出公司董事,新增董事为庄坚胜。 资料来源:天眼查 中兴通讯成立于1997年11月,注册资本41.9亿元人民币,法定代表人为李自学,经营范围包括生产程控交换系..."
曾涉性侵养女丑闻!鲍毓明退出中兴通讯董事行列,和讯网,2020年7月20日,天眼查数据显示，近日，中兴通讯股份有限公司发生工商变更，Yuming Bao(鲍毓明)退出公司董事，新增董事为庄坚胜。来源：天眼查 资料显示，中兴通讯成立于1997年11月，注册资本41.9亿元人民币，法定代表人为李自学，经营范围包括生产程控交换...
鲍毓明退出中兴通讯董事行列,大河报网,2020年7月20日,"观察者网消息,启信宝系统显示,7月17日,中兴通讯股份有限公司发生工商变更,Yuming Bao(鲍毓明)退出公司董事,新增董事为庄坚胜。 启信宝查询截图 中兴通讯股份有限公司成立于1997年11月,注册资本41.9亿人民币,法定代表人为李自学,公司..."
鲍毓明退出中兴通讯董事行列 曾涉性侵养女丑闻,腾讯网,2020年7月20日,"中新经纬客户端7月20日电 天眼查数据显示,近日,中兴通讯股份有限公司发生工商变更,Yuming Bao(鲍毓明)退出公司董事,新增董事为庄坚胜。 来源:天眼查 资料显示,中兴通讯成立于1997年11月,注册资本41.9亿元人民币,法定代表人为李自学,经..."
鲍毓明退出中兴通讯董事行列!昨日司法部点名鲍毓明损害律师形象,和讯网,2020年7月20日,7月20日上午消息，天眼查数据显示，近日，中兴通讯股份有限公司发生工商变更，Yuming Bao（鲍毓明）退出公司董事，新增董事为庄坚胜。中兴通讯股份有限公司成立于1997年11月，注册资本41.9亿人民币，法定代表人为李自学，公司经营范围包括...
《中兴通讯股东大会 殷一民、赵先明、李自学等出席》的相似新闻,云财经网,2020年6月29日,"中兴通讯殷一民:对新的董事会有极高的信任和期望 06-29 10:52:12 金融界 中兴通讯29日召开股东大会 殷一民、赵先明、李自学等出席 06-29 21:56:10 和讯 中兴通讯董事会大换血!李自学任董事长,禁令影响几何、未来战略何从,看股东..."
"“芯片乌龙”致股价飙升后,中兴通讯突遭大股东减持",腾讯网,2020年6月23日,"对于本次权益变动目的,中兴通讯表示,这是中兴新经营所需,并拟优化资产配置。并且,中兴新不排除在未来12个月内增持或减持该公司股份的可能。 公告截图 事实上,中兴通讯此次突然减持让不少投资者感到“套路深”,原因就在于不久前该公司刚..."
重磅签约!,搜狐网,2020年6月12日,"蓝绍敏会见李自学一行 苏州市政府与中兴通讯签署深化战略合作协议 今天,省委常委、市委书记蓝绍敏会见了中兴通讯股份有限公司董事长李自学一行。 会见后,苏州市政府与中兴通讯签署了深化战略合作协议。  在会见中 蓝绍敏代表苏州市委、市政府 ..."
周末要闻回顾:中央政治局会议首提“六保”,同花顺财经,2020年4月19日,4月17日，中兴通讯2019年度业绩说明会在线上举行。中兴通讯董事长李自学，执行副总裁兼财务总监李莹，执行副总裁、首席运营官谢峻石，副总裁崔丽，董事会秘书、公司秘书丁建中出席会议。粤餐饮协会与美团发出声明：不再独家合作 加大返佣比例...
