title,source,time,summary
我州这些集体和个人上榜!全省脱贫攻坚先进集体和先进个人拟表彰...,康巴传媒,4月8日,自贡市立华牧业有限公司 自贡市扶贫开发协会 自贡市自流井区人力资源和社会保障局 自贡市贡井区卫生健康局 自贡市大安区新店镇党委 自贡市大安区何市镇黄桷村村委会 自贡市沿滩区扶贫开发局 自贡市沿滩区瓦市镇党委 荣县旭阳镇党委 荣县...
"第六届全国文明城市名单公布,北京市延庆区上榜",北京日报客户端,2020年11月21日,"党的十八大以来,各地区各部门坚持以习近平新时代中国特色社会主义思想为指导,深入学习贯彻习近平总书记关于加强社会主义精神文明建设的重要指示精神,增强“四个意识”、坚定“四个自信”、做到“两个维护”,大力弘扬社会主义核心价值观,深入推..."
"江苏这些“80后”“90后”“00后”,火了!_家事",搜狐网,2020年10月14日,"千瓦高峰电力缺口,镇江公司紧锣密鼓的开始了储能电站建设,从项目启动到可研、设计、验收、并网送电,时任变电运维室副主任的包磊全过程参与了储能电站建设,克服时间紧、任务重、技术新等一系列困难,全力以赴带领团队按期投运镇江地区8座..."
直接认定高级职称!江苏这526人走了“绿色通道”|南京林业大学|...,网易,2020年7月14日,江苏省农垦农业发展股份有限公司 正高级经济师 6 王成森 捷捷半导体有限公司 正高级工程师 7 王会方 南京市特种设备...江苏亨通光纤科技有限公司 正高级工程师 42 严海锦 江苏科成有色金属新材料有限公司 正高级工程师 43 克磊 镇江华...
全国万名优秀创新创业导师人才库首批入库导师名单,中国教育在线,2017年11月7日,1 白云 凹凸人网(北京)咨询有限公司 北京市教委 2 蔡晓君 北京石油化工学院 北京市教委 3 陈佳楠 中青信用有限责任公司 北京市教委 4 陈郁 北京源型悦雅教育咨询有限公司 北京市教委 5 程军 中关村科技园区丰台园科技创业服务中心 北...
[年报]大港股份:2011年年度报告,中国财经信息网,2012年3月24日,"1、全资子公司镇江大成新能源有限公司 (1)根据公司2007年第二次临时股东大会决议,公司对镇江大成硅科技有限公司实施了75%股权的 收购,镇江大成硅科技有限公司实收资本由“430.010956万美元”变更为“1200万美元”,公司占75%的 股权。"
科技型中小企业创新基金2009年度第2批项目立项公告,生物谷,2009年11月20日,7 09C26213203689 基于目标的版本化文档管理系统 镇江星浪科技产品有限公司 无...107 09C26213203789 环保绿色锌镍动力电池 东台天祥新能源有限公司 无偿资助 ...天然动植物制成无毒副作用的新型戒烟产品(口服和贴剂)—戒烟露 杭州灵泽...
